حت حمايه نلتجئ يا والد الله قديس تغفلي طلب احتياج يك نجي دائم مخاطر عذراء مجيد مبارك امين,Pontifex_ar
كنيسه سار درب حنان شفقه ابن كنيسه شخص متواضع حنون مبتسم مفعم حب,Pontifex_ar
نبن حياه ايمان صخر مسيح,Pontifex_ar
سوع وسيط صالح اب ايض,Pontifex_ar
تصغ بشريه صرخه طفل شرق اوسط مسح دمعه استعاد عالم كرامه,Pontifex_ar
ننا تعلم كثير فضيله داخل اسره مسيحي شيء احب بحث مقابل,Pontifex_ar
ن قلب رحيم تحلى شجاعه ترك رفاهي عرف ذهب لقاء اخر استطاع عانق,Pontifex_ar
تعالى مرهق مثقل اريحكم 11 28 رساله مناسبه يوم عالمي ثامن عشرون مريض,Pontifex_ar
ل الله فعل حرك حياه شيء وضع الله,Pontifex_ar
ي عالم وجب قدم خير قادر رد,Pontifex_ar
نتشبه تريزا عمل رحمه نهج حياه درب قداسه,Pontifex_ar
ا صليب مسيح علم فجر شمس اقوى ظلام ليل محبه الله ابدي انتصر دوام,Pontifex_ar
الله مصباح نظر مستقبل ضوء امكن قرا علامه زمن,Pontifex_ar
عالم دفع نظر نفس امتلاك متعه انجيل دعا انفتاح خر مشاركه فقير,Pontifex_ar
ي سر مصالحه وجد درب عوده رب اكتشاف معنى حياه مجدد,Pontifex_ar
ندم وجد حوار عائله حل توتر شكل جيد,Pontifex_ar
ن حضور مالك حارس حياه مساعده مسيره يري ايض وصل,Pontifex_ar
تعلم عذراء مريم شجاعه اتباع كلمه الله,Pontifex_ar
تقاسم خوف مسيره مهاجر لاجئ,Pontifex_ar
ن صلاه امكن دخل علاقه ثابت الله مصدر فرح حقيقي,Pontifex_ar
صلى مسيحي ضحيه اضطهاد عرف مجابهه شر خير,Pontifex_ar
ن اراد بلغ قلب الله فسر درب رحمه اسمح ل يعاملك رحمه,Pontifex_ar
ن عذراء اراد حمل ل عطيه كبير يسوع حمل ل محبه سلام فرح,Pontifex_ar
ود توجه شكر انضم امسيه صلاه صوم سلام,Pontifex_ar
علم شهيد ممتلك سمعه عظمه امر اهم مسيح كنز حقيقي وحيد,Pontifex_ar
ا امكن تلميذ فاتر كنيسه حاجه شجاعتنا اعطى شهاده حقيقه,Pontifex_ar
طلب امن طوباوي تتشفع شفاء شخص تعرض شكل شكل اعتداء اثبت فرد عائله مسيحي عزم حازم عدم سماح ابد حصول حاله مجدد,Pontifex_ar
اتجار كائن بشريه عضو عمل قسري دعاره عبودي معاصر جريمه ضد بشريه,Pontifex_ar
اسم معمودي ايض استنار ايمان ينير قلب راى شيء نور اخر,Pontifex_ar
وباء ذكر وجد اختلاف حد تالم ضعيف متساوي قيمه حصل هز داخل حان وقت ازاله عدم مساواه اصلاح ظلم هدد جذر سلامه بشريه اسر,Pontifex_ar
لمهاجرون اخت بحث حياه افضل بعيد فقر جوع حرب,Pontifex_ar
اعطى رب دوام رجاء مستقبل قوه مضي قدم,Pontifex_ar
يها رب اعط نعمه بكاء لامبالاه عدم ايمان موجود عالم موجود,Pontifex_ar
ندم ننفتح نعمه الله مستحيل حقيقه,Pontifex_ar
ا مريم امن قوي وقت ظلام ضيق هزيمه واضح,Pontifex_ar
نال ل عذراء مريم نعمه حرك روح قدس قوه شهد مسيح صدق انجيل,Pontifex_ar
سوع اعان دوم تغلب تجربه غنى غرور كبرياء حاول دمر حقيقه,Pontifex_ar
صوم زمن توبه هدف اقام مسيح جدد هويه كمعمدين,Pontifex_ar
ن فرح مسيحي اتى روح قدس اعطى حريه حقيقي عطيه حمل يسوع,Pontifex_ar
ي صمت صلاه فقط امكن تعلم اصغاء صوت الله,Pontifex_ar
ات قبر ظهر يسوع نواه رساله مسيحي,Pontifex_ar
ل سلطه قديس كفاح صالح خير عام تخلي مصلحه شخصيه,Pontifex_ar
ن رب قدم بسيط خبز دعا ايض نبدد حياه اتباع الف امر تافه خلق ادمان ترك فراغ داخل افخارستيا اطفا جوع شيء اشعل رغبه خدمه,Pontifex_ar
مكن حياه استمر فقط فضل سخاء حياه اخر,Pontifex_ar
يوم يوم عالمي صلاه عنايه خليق وصل لنعمل,Pontifex_ar
قاد روح قدس مسيره ارتداد حقيقي اكتشف مجدد عطيه كلمه الله,Pontifex_ar
كر مكسيك مكسيكي رافق رب عذراء غوادالوبي دوم,Pontifex_ar
تى رجل قليل ايمان رب خلص رجا رب دائم,Pontifex_ar
ن جواب مسيحي عاصفه حياه تاريخ امكن رحمه محبه شفوق سيما تالم تعب متروك,Pontifex_ar
طلب شخص اراده صالح ساهم خلق ثقافه لقاء تضامن سلام,Pontifex_ar
اسم يسوع امكن اظهر شهاده سلام ممكن,Pontifex_ar
ذكر صلاه اعتنى شخص مريض تفان روح تضحي,Pontifex_ar
كثير شاب وصل فعل مدينه ريو كثير اخر وصل ساعه قادم التقى ثلاث يوم فقط,Pontifex_ar
ن مؤمن حرك ايمان ذهب باحث الله مكان مخباه غرار مجوس ادرك رب انتظر,Pontifex_ar
اكل رب رئيس ملاك مهمه دفاع بشر,Pontifex_ar
ندم التقى شخص معوز حق تعرف وجه الله,Pontifex_ar
ي زمن صوم اربعيني وجد سبيل ملموس تغلب لامبالاتنا,Pontifex_ar
ن اتجار بشر انتهاك رهيب كرامه بشريه فتح افه مخزي ولنلتزم مكافحه,Pontifex_ar
دى فرد شيء قاسي قلب دواء ضد قساوه قلب ذكرى تذكر رب امر حافظ قلب مفتوح امينه,Pontifex_ar
ي ساعد راى وجه الله امكن احد راى,Pontifex_ar
ا امكن وحد ازال تراب لوث قلب وحد يسوع عرف قلب احب امكان شفى زمن صوم زمن شفاء,Pontifex_ar
سال رب زمن مجيء ذكى ايمان مسيح اتى خلص ساعد دائم وفي دعوه تلميذ مرسل,Pontifex_ar
لاف صنف نبات حيوان انقرض سنوي تمكن معرفه ان تمكن ابن رؤيه سبب الف صنف مجد الله وجود حق,Pontifex_ar
فرحه حقيقي يسوع,Pontifex_ar
ن امر مذهل غايه خلص الله راضي سحق شر رد كلمه تواضع فقط صبر طاعه عبد قوه محبه,Pontifex_ar
سوع سمح بحث وجد بحث تحرك خرج ذوات,Pontifex_ar
ن هدف مسيحي تشبه دائم يسوع اتباع نموذج سلوك,Pontifex_ar
يها رب يسوع قادر احب احب,Pontifex_ar
وصل معا حاكم عالم سياسي بدا بحث سبيل خروج ازمه مرحله وباء وجد حل صحيح دوام صالح ناس شعب,Pontifex_ar
طلب رب يوم نعمه نسي مجانيه وحي الله اظهر نفس ل عطيه عطيه ل دور اعطى اظهر اخر عطيه ملكيه خاص ب,Pontifex_ar
ين يسوع صديق حصل فرح هدوء سعاده,Pontifex_ar
صلى هاب الله نعمه راى عالم احد مات جوع,Pontifex_ar
نكل كنيسه بشريه اسر كون واسع رب فاض رحمه خليق,Pontifex_ar
شكر الله دوم حاضر قريب رحوم وجه رحمه 6,Pontifex_ar
سوع انتزع كلمه اخير موت امن ب تحول محبه اب رحيم حياه ابدي طوباوي,Pontifex_ar
وقف ايمان مقبره عزيز وصل ايض ميت تذكر احد,Pontifex_ar
ساعد عذراء مريم خطوه يومي بناء سلام محبه عداله حق,Pontifex_ar
صلى كنيسه دائم قداسه تواضع بلغ محبه الله واسطه خدمه فقير شخص مهمل مريض,Pontifex_ar
انبغى مسن عائله شعر منفي كبير سن كنز مجتمع,Pontifex_ar
ل سار اناني قال الله افسد تاريخ محبه,Pontifex_ar
ن اسره ينير انجيل مدرسه حياه مسيحي تعلم امانه صبر تضحي,Pontifex_ar
عباده تعلم نبذ انبغى يعبد اله مال اله استهلاك اله لذه اله نجاح ارتقى مستوى اله,Pontifex_ar
ن رب انتظر حمل ل بؤس اكتشف رحمه ه,Pontifex_ar
ن كلمه الله اعطى ل كلمه حياه تحول تجدد كلمه حكم ادان كلمه شفى هدف مغفره كلمه نور خط,Pontifex_ar
ننا ننهل مغار فرحه سلام جلب يسوع عالم,Pontifex_ar
علم مريم رجا الله بدا شيء معنى  بدا احتجب,Pontifex_ar
عو مؤمن علماني مجتمع اسر خمير حياه مسيحي,Pontifex_ar
طلب روح قدس اشرع ل باب قلب تمكن يسوع خول حمل ل رساله رساله خلاص,Pontifex_ar
سلام حقيقي عطيه الله نبع قلب مضمد مصالحه امتد عانق عالم اسر,Pontifex_ar
ا شيء وضع خاطئ تائب رحمه الله بقي عناق مغفره,Pontifex_ar
عزائي شاب ابار خطوه كراكوفيا حج ايمان اخوه,Pontifex_ar
نبغي محاربه فساد قوه شر عباده مال جرح كرامه بشريه,Pontifex_ar
تضرع يوم الله جمع شعب مؤمن يا امن امنحينا رجاء اهدي وحده يا امراه خلاص نعهد عام احفظ قلب,Pontifex_ar
عضد اب خدمه يسوع قهر شر وقع عضد معاناه تغلب شر خير وحد مسح تمام شر محبه مسح تمام,Pontifex_ar
حب الله عمومي الله توجه نظره محبه رجل امراه اسم لقب,Pontifex_ar
ن محبه اقبل لامبالاه تحلى شفقه محبه الزم قلب سبيل اخر,Pontifex_ar
ن اسره مسيحي مرسل اعلن عالم محبه الله,Pontifex_ar
تواصل رحمه عنى مساهمه قرب صالح حر تضامني ابن الله بشريه,Pontifex_ar
تذكر يوم دولي قضاء عنف جنسي حاله نزاع مراه حمل داخل حراسه حياه شركه شيء عنايه شيء تالي طريقه تعامل ب جسد مراه فهم مستوى انسانيه تحلى ب,Pontifex_ar
يها شاب عزيز مسيح عول صديق ل شاهد محبه لامتناهي,Pontifex_ar
صلى ضحيه انفجار بيروت عائله صلى لبنان تمكن التزام مكون اجتماعي سياسي ديني مواجهه مرحله ماساوي اليم,Pontifex_ar
ي ختام سنه تذكر يوم اسبوع اشهر عاش شكر رب قدم ل شيء,Pontifex_ar
ا استطاع تخيل مسيحي عرف ابتسم حاول تقديم شهاده مبهج ايمان,Pontifex_ar
ن بقي راسخ مسيره ايمان رجاء وطيد رب كمن سر مسيره,Pontifex_ar
م نسي تركيز ماي حق نسي ولد الله,Pontifex_ar
واحد مساهمه قدم مجتمع استثنى احد تقديم شيء خير,Pontifex_ar
تمكن مثال راعي بيت لحم امتلا دهشه تامل طفل يسوع ابن الله,Pontifex_ar
طلب رب نعمه نتر شيء مضي قدم بشاره شهاده مثال بطرس اندراوس,Pontifex_ar
ا امكن نام سلام طفل مات جوع مسنون رعايه صحي,Pontifex_ar
ا زنزانه معزول درجه استبعد رب محبه وصل مكان صلى فتح واحد قلب محبه,Pontifex_ar
ن مهم ل صديق وسع وثوق ب ضروري ثقه رب خاب امل ابد,Pontifex_ar
ربط صلاه مجدد الله محبه قريب صوم نفس الله حياه وقيعه انبغى استثمر,Pontifex_ar
ا امكن اختزال صلاه ساعه واحد يوم احد  مهم ل علاقه يومي رب,Pontifex_ar
يس كنيسه غايه معنى اخر تقديم شهاده يسوع نسي,Pontifex_ar
تضرع روح قدس منح نور قوه كنيسه مجتمع امازون عانى سبب وباء صلى اشد فقر عزل منطقه عزيز اوج نداء حصل عنايه صحي,Pontifex_ar
ن فرح اتى يقين رب قريب حنان رحمه مغفره محبه,Pontifex_ar
سال فضل تذكروني صلاه معاون رياضه روحي يوم جمعه,Pontifex_ar
دعو كنيسه سمح عطف اب غفران غمر,Pontifex_ar
ي سماء قيمه ملك اعطى,Pontifex_ar
تامل قبر مسيح فارغ جدد ايمان شيء ضاع,Pontifex_ar
احتفال يوبيل رحمه عنى تعلم بقي اسير ماضي امن امر امكن مختلف,Pontifex_ar
شاب حبيب صلى سلام عالم,Pontifex_ar
شاب عزيز اراد يسوع ان صديق ل رغب ان نقل فرحه صداقه مكان,Pontifex_ar
شاب عزيز سقط سطحيه  حياه مسيحي اعلى,Pontifex_ar
ن يسوع فقط مجرد صديق معلم حقيقه حياه كشف طريق وصول سعاده,Pontifex_ar
امكان انجيل سمع يومي صوت يسوع كلم فلنحمل دائم انجيل صغير,Pontifex_ar
كنيسه جماعه مسيحي واحه رحمه وسط كثير لامبالاه,Pontifex_ar
خدمه اسلوب عاش رساله اسلوب وحيد تتلمذ يسوع,Pontifex_ar
الله احب خطيئه نقص خطا امكن راي,Pontifex_ar
ل غريب قرع باب فرصه لقاء يسوع مسيح,Pontifex_ar
ن محبه صبر حنان كنز رائع امتلك سعى اقتسام اخر,Pontifex_ar
خطوه صلاه مرء متواضع توجه اب قائل نظر خاطئ  رب اصغى,Pontifex_ar
مسيح خجل ابد صليب,Pontifex_ar
ريد كنيسه قريب شخص محبه شفقه تعزيه اتى مسيح,Pontifex_ar
كنيسه طبيعه مرسل قائمه تمكن رجل امراه التقى يسوع,Pontifex_ar
ن استسلم فكره شرق اوسط مسيحي ودع صلى يوم سلام,Pontifex_ar
مجيء مسيره بيت لحم ودع سمح نفس اجتذب نور الله متجسد,Pontifex_ar
قطن قلب انسان توق عيش حريه ارض تغيير ممكن اخوه تضامن,Pontifex_ar
صوم ايض تغيير موقف اخر خليق تجربه التهام شيء اشباع جشع قدره تامل محبه اخر,Pontifex_ar
عون طلب عذراء مريم تعلم عيش ايمان عمل يومي اعطاء رب مكان اكبر,Pontifex_ar
ن محبه الله حال عالم تاريخ,Pontifex_ar
نمى اخوه مقاسمه تعاون ساهم بناء مجتمع افضل مسالمه,Pontifex_ar
سوع صديق امين ترك ابد نخطئ انتظر صبر,Pontifex_ar
تذكر سنه ايمان ايمان امتلاك مشاركه مسيحي رسول,Pontifex_ar
ي عيد كرسي بطرس رسول رفع شكر الله رساله موكل بطرس رسول خليفه جمع شعب امه يقودوه محبه حق درب خلاص,Pontifex_ar
ن مشكله عمل خطير سبب ارتفاع معدل بطاله شاب تعلق ايض كرامه عمل,Pontifex_ar
مكن كلمه الله انعش قلب قحلاء,Pontifex_ar
كشف ل يسوع وجه الله محبه,Pontifex_ar
ن مجتمع نبذ طفل مسن مجتمع انفصل جذر مستقبل قاتم,Pontifex_ar
م خير حصل ترك رب يزلزل حياه فاتر سطحيه,Pontifex_ar
نفسح مجال كلمه الله قرا يومي ايه كتاب مقدس اكتشف الله قريب ينير ظلم قاد محبه عرض حياه,Pontifex_ar
عائله مكان والد معلم ايمان ابن,Pontifex_ar
ي بساطه مغار التقى حنان الله تامل ب حنان تجلى طفل يسوع,Pontifex_ar
ا رب ساعد عيش فضيله نبل احب حد,Pontifex_ar
يا رب ترك رحمه عاصفه ردد مجدد خاف 28 5 بطرس القى عنا را 1 بط 5 7,Pontifex_ar
يد ميلاد غالب عيد صاخب نافع ل نصم قليل تمكن سماع صوت حب,Pontifex_ar
ن ايمان سار يسوع درب عالم يقين قوه روح خضع قوه شر سلطه محبه الله,Pontifex_ar
ناك فكر ان اتى وباء مشكله واجه مشكله فقر عمل جوع وصل معا شخص ساعد يوم فكر غد مستقبل ايض يساعدوننا,Pontifex_ar
يها شاب عزيز رجاء كنيسه حلم مستقبل شارك سينودس عام 2 ۰ 18,Pontifex_ar
ا امكن بقي منغلق رعيه جماعه طوق انجيل كثير شخص,Pontifex_ar
حان وقت تغيير عقليه توقف اعتقاد تصرف اثر عانى جوع,Pontifex_ar
بدا يوم اسبوع رائع مدينه ريو  فرصه تعميق صداقه يسوع مسيح,Pontifex_ar
حتفل يوم يوم عالمي صليب احمر هلال احمر وصل شخص عمل مؤسسه قيمه بارى رب عمل افاد جد,Pontifex_ar
ن اسبوع صلاه وحده مسيحي سنه مخصص موضوع ضيافه,Pontifex_ar
يها رب اله سلام استمع تضرع وهب سلام ارض مقدس شالوم سلام باش,Pontifex_ar
الله محبه اعلن واسطه حب,Pontifex_ar
ن مسيحي دائم ممتلئ رجاء  امكن اصاب احباط,Pontifex_ar
طلب رب كلمه مصدر نور حياه مسيحي اتحاد دوام,Pontifex_ar
صوم اربعيني زمن تقرب مسيح واسطه كلمه الله سر مقدس,Pontifex_ar
ن رب صنع عجيبه اعتبر نفس بار عرف معوز مستعد فتح ل قلب,Pontifex_ar
رهان حياه قيامه شعب اله مال قبر جوع عبودي حرب صناعه سلاح طفل عاش علم,Pontifex_ar
مسيحي شخص عرف نقص نما رب قلب قلب اخر,Pontifex_ar
م صبور رب احترم وضع يسير قرب ساري تلميذ عماوس اصغى اقلق احترم احب اسمع فهم جيد اعطى جواب صحيح,Pontifex_ar
انجيل يوم يوحنا 11 1 45 قال ل يسوع قيامه حياه تحلى ايمان وسط بكاء اثبت ايمان بدا موت انتصر  اسمح كلمه الله اعاد حياه حل موت,Pontifex_ar
ن رب وسط اعتنى ب قرر,Pontifex_ar
حياه كنز حقيقي اكتشف فقط اعطى اخر,Pontifex_ar
مغار ذكر اهميه توقف تامل فقط امكن استشف اهم حياه ترك خارج منزل صخب عالم تمكن عندها انفتاح كلمه الله تحدث صمت,Pontifex_ar
ي خضم كثير مشكله خطير وجب فقد رجاء رحمه الله لامتناهي,Pontifex_ar
ن هرب صليب هرب قيامه,Pontifex_ar
تامل اله طفل اشع نور تواضع مغار امكن ان ايض شاهد تواضع حنان صلاح,Pontifex_ar
يها شاب عزيز تعب اداه سلام فرح اتراب,Pontifex_ar
ن انجيل يوم لوقا 2 224 ۰ عيد تقدمه رب ظهر ل اندهاش مريم يوسف سمعان حن حصل قدره اندهاش لقاء رب خصب,Pontifex_ar
رغب تشجيع تامل مريم شفاء مريض ضمانه حنان الله كائن بشري,Pontifex_ar
جب حياه موقف نمط حياه علامه ملموس واقع الله قريب,Pontifex_ar
شكر رب دائم سيما طول اناه رحمه,Pontifex_ar
لال يوم الم كبير وجد خوف كبير خوف مسن عاش وحد خوف عامل عمل ثابت خوف فرد رفع صلاه معا رب ساعد تحلى ثقه تغلب خوف,Pontifex_ar
طلب رب موهبه حوار صبر قرب استقبال احب سامح ادان,Pontifex_ar
قال رب عنى ل شجاعه نعانق حياه محبه هشاشه صغر تناقض,Pontifex_ar
ليب مسيح هزيمه صليب محبه رحمه,Pontifex_ar
مكن رحمه ساهم فعل بناء عالم انسانيه,Pontifex_ar
حرب انكار حق وصل مسؤوليه تفادي حرب شعب,Pontifex_ar
ن يوم عالمي ارض فرصه جدد التزام محبه بيت مشترك مستودع استغل نعتن ارض عضو اشد ضعف عائله بشريه,Pontifex_ar
رجاء مسيحي عطيه منح الله ايا خرج ذوات فتح ل قلب,Pontifex_ar
حق ساكن امازون تلقى بشاره انجيل بشاره اله احب حد انسان اظهر تمام حب مسيح صلب حياه,Pontifex_ar
عب غفر اخر يا رب امنح رحمه غفر دائم,Pontifex_ar
ي عبد خطيئه يارب حرر,Pontifex_ar
ن تعلق امر باطل ابعد الله اسقط سخافه,Pontifex_ar
ي اسره طبيعي حمل محتاج خاف ضعف,Pontifex_ar
ن مسيحي مبشر مقدار شهاده قدم محبه الله مبشر عطف حنان الله,Pontifex_ar
تمنى ل كاس عالم رائع العب روح اخوه حقيقي,Pontifex_ar
ني اشجع شهد نمط حياه شخصيه جماعي نمط مجانيه تضامن خدمه,Pontifex_ar
ي صليب اظهر ل يسوع عظمه محبه قوه رحمه,Pontifex_ar
نحاسب علاقه فقير قال ل يسوع فقير دائم ابد قال دائم حاضر فقير جوهر محور انجيل نحاسب,Pontifex_ar
ساعد تواضع رفع عاتق حمل خر,Pontifex_ar
ن فساد سرطان دمر مجتمع,Pontifex_ar
ا حاجه انفتاح شخص شعر وحده ارتباك بحث معنى حياه,Pontifex_ar
سوع حاضر دوام قلب مفتوح يغدق رحمه غفر احتضن تفهم,Pontifex_ar
ساعد قراءه يومي انجيل تغلب اناني اتباع رب يسوع عزم,Pontifex_ar
عالي روح قدس حرر انغلاق خلق فرح اعلان انجيل,Pontifex_ar
صوم دعوه توقف ذهاب جوهري صوم استفاضه صرف انتباه اساسي منبه نفس,Pontifex_ar
ثمين الله رحمه حيال استطاع نال فقط اعطى شيء مقابل,Pontifex_ar
اختبر مغفره الله ولد مجدد فعل انطلق مجدد مغفره  وجد نفس اعتراف خطيئه,Pontifex_ar
ن اسره مكان نتشكل شخص اسره قالب ساهم بناء مجتمع,Pontifex_ar
ن ثقافه لقاء عرف غض نظر اختلاف ابن الله,Pontifex_ar
ا تسمحن عاش سدى زمن صوم مناسب طلب الله ساعد مسيره توبه حقيقي,Pontifex_ar
ن شر معد خير ايض سمح خير اعدى عد اخر ب,Pontifex_ar
شكر ارسل ل يوم كثير عالم رساله تهنئه مناسبه ذكرى خمسون لرسامتي كهنوتي عيد ميلاد شكر جزل صلاه,Pontifex_ar
تحلى ميلاد شكل خاص طعم رجاء نور الله سطع رغم ظلم,Pontifex_ar
د حدث حياه ابتعد رب فقد نضاره دعوه طلب نعمه عوده دائم لقاء نظر ولد داخل رغبه اتباع,Pontifex_ar
سير معا صلاه معا عمل معا درب رئيسي وحده مسيحي,Pontifex_ar
ن قلب مسيح كبير جد درجه رغب استقبل ثوره حنان,Pontifex_ar
ن مفرح صلى يوم لوثري روما بارى الله عمل حوار وحده مسيح,Pontifex_ar
ننا راى فقير وجه يسوع فقير,Pontifex_ar
تامل طفل يسوع محبه متواضع لامتناهي نقل ل بساطه شكر فعل,Pontifex_ar
ن روح قدس بدل جدد خلق تناغم وحده هاب شجاعه فرحه رساله,Pontifex_ar
دي رجاء كبير نسبه ل حصاد نعمه كبير عد الله وسط,Pontifex_ar
رب يسوع نشر صليب شعب متحارب تعلم درب مصالحه حوار مغفره,Pontifex_ar
عائله عنصر اساسي تنميه بشري اجتماعي ممكن,Pontifex_ar
داس احد محور حياه كنيسه التقى رب قائم موت نصغي كلمه نغتذي مائده كنيسه,Pontifex_ar
مئه سنه افتقد رب شعب ارسل ل راعي قديس يوحنا بولس ثاني راعي ل صلاه قرب شعب محبه عداله سار دائم رحمه,Pontifex_ar
وصل معا فنان ملك قدره كبير ابداع ادلى جمال درب انبغى اتباع منح رب نعمه ابداع مرحله,Pontifex_ar
نا توجه اماره عربي متحد اذهب بلد كتب معا صفحه حوار سير معا درب سلام صلى,Pontifex_ar
سر مقدس حضور يسوع مسيح وسط لذا مهم ممارسه سر اعتراف تقدم مناوله,Pontifex_ar
ا احد استطاع شعر مستثنى مشاركه فقير عداله اجتماعي نور انجيل 2 ۰ 1,Pontifex_ar
حن حاجه اعتراف قيمه انسانيه مشترك اسم امكن بد تعاون بناء,Pontifex_ar
صوم فقط امتناع اكل تعلق سليم سيما خطيئه,Pontifex_ar
الله عرف افضل حاجه  وثق ب سبيل مختلف جد سبيل,Pontifex_ar
طفل حق بيئه عائلي سليم محمي,Pontifex_ar
حن مسيحي مسح فضل معمودي اختيار رب عطيه خالص طلب يوم روح قدس عرف حافظ عطيه امانه قداسه مسيحي,Pontifex_ar
