لمح كثير ضروره تريث دعم مجاهيل خصوص حساب عمل مجموعه حذر حساب تحرك قروب سبق دخول نادى دخل يوم حمله ترحيب خليه عمل صالح اسمي استخدم معرف تمكين غرض خطير 72,monther72
حرص اعاده مديوني خفيف استطاع تكاتف انهى نغتنم ماتبقى شهر كريم ساهم تفريج مسلم فرصه شارك قليل سال الله عتق نار اللهم فرج مسلم كرب فرج الله يوم قيامه ابشر 72,monther72
ي خبر عاجل ان اتي موقف متقدم لاحوار سحب قوه خارج سمح وجود قاعده احتلال تركي ف مقدر ليبي فقط اغير جيش جيش 72,monther72
قياده فارس شيء مختلف شكر موصول مبدع دائم ابد استاذ دعوه تمتع نشوه طرح 72,monther72
رسول ل احمد فديو مؤثر جميل تغريد حساب ود نشر فديو معترض تغريد رواق عثماني مدفع رجل انيق تقدير اجتهاد رب بحث شهره ساعد احمد ايجاد وجه اعتراض تالم رواق رجل انيق 72,monther72
حد قال ماضر مافعل يوم مشبه ايا عثمان سال الله سلامه دين رسول صلى الله سلم قال عثمان الله اطلع قال ماضر مافعل غيب ان وحى قبح الله انتكس فطره 72,monther72
رسول كادر ارسل فرقه قتل لايقدم محاكمه ان تسريب علم سبب تمنى خطوه ان تم استعاده ملشيات حقق باشر قتل خيط خيانه قبح الله قبح نظام 72,monther72
دير وكاله طاقه ذري اتصل مهنئ تشغيل قال وكاله ذري دعم دوله اخر وصول طاقه نظيف علم قال خبير طاقه عام خبير قال ل مفاعل ايران تخصص مختلف تستح 72,monther72
قول قذافي عنا كلمه اقام حجه قال مطيري تحرك منطلق اسلامي معلوم موقف سنه كتاب اخضر مايكتبه مطيري مسجد حج امه لاعلاقه دين ب ار احد خاصم قصم الله 72,monther72
قال انتظر غد خبر سار قال حمدلله اقر مسلم دحر خليه ملشيات يد حفيد عمر مختار قياده 72,monther72
دارى امر سحب جناسي غفران هواجر منح اكبر ربع وجد عربي اصل دافع تميم نظام انقلاب 72,monther72
ندك نابي يا خالد اتحداك تجاوب اهل تطلع مقطع والد اعتقل احداث راى خامس يوم يوعدونكم استلمتوهم مغرب يوم انتظر نابي اثبت خروج تطفي نار قلب اهل اهانه حامي والد عمان خلك موضوع اهم انقلاب 72,monther72
علامه عظيم علامه بشريه شهد تاريخ مر زمن اسره ملك ثلاث نفس سلاح بيت امام تركي ابن عبدالله اختصار سيره عظيم وماهدفها حمدلله اعز ال سعود 72,monther72
امير واحد فارس عصر حديث احد امير امام عبدالعزيز ابن محمد رحم الله اعتبر اعظم امير عصر حديث 72,monther72
نوات طويل حذر خطر امه كتب غنوشي كثير تصور دعوه رقص طرب الم كريم قال كريم اهل ب كويت تمنى سماع خبر الغاء زياره تغريد سنه خطر ذكر موقف غزو كويت 72,monther72
اب ماجاء فضل تنكيد ابو جهاد ابو نضال ابو كفاح 72,monther72
ل عام عز رفعه منع حفظ الله سيد هنيء ل عيد عيد وعيد سمى ضحى وعيد عيد لبس سلم مخروق اعطى مجدد فذ يوم يوم ورى اوحد اوحد 72,monther72
ان خبر عاجل مجلس نائب مجلس قبيله رحب قال رئيس كتب تصريح ل صدى داخل ليبي لايخفى الم عاش عربي حكم عجم احتل ارض روح عزيز خشي عوده هيشنتح اردوغان 72,monther72
م يوم امه سال الله ليله مبارك عزا حفظ اعز ب دين اعز ب امه 72,monther72
مكان صاح شرعيه و شرعيه صوت شعب صندوق رفض مجلس نائب رفض مؤتمر ليبي تمسك اتى دبابه غرب وجد ليبي شريف وقوف لاغير عمد اصل طالب نجده 72,monther72
غرب اولائك اعتقد حكومه امن سياسه اراد حوار سياسي يا ساد حكومه انتهى فتره طويل سلم حكم مكان اخوان و و كلمه مشهور رقبه 72,monther72
و مكان جامعه حمد ابن خليفه صله مارك احصائي قدم مارك اشاره حساب يزار اكد تعمد نظام تغييب معلومه حدث خصوص حديث و و انقلاب مشكله ازكمت انف اهل بالي 72,monther72
ل شيء جميل استشاري دكتور عبدالرحمن صغير كبير 72,monther72
ا طيب قال اقشر والد راى عادي مايعني قال احترم ابو شوي لاتقول اقشر ثاني شيء عط احترام قال ولاء عيال ماهو عكس عنى جابي ولاء 72,monther72
قال تحقيق جرى وليد فارس عضو حمله ترامب دور مزعوم تاثير رئيس اضاف تحقيق استند معلومه اتى داخل خجل قال معلومه اتى عموم اغراب سجد فرح نصر اسرائيل لاتستبعد خسه دناءه 72,monther72
رعيه منتهي مؤقت وقت انتهى فعل موقف جيد نامل ادرك امه خطر ذنب خط احمر وضع نظام ملشيات بدايه تطهير تراب نجاس ارهاب 72,monther72
ترند ثالث سعوديه عنى رساله محبه ود عرفان كثير وجد ضال ترند شكر استاذ عبداللطيف اسر قلب محبه سال الله بارى عمر عمل صحه مالك ولد اللهم 72,monther72
اكتب اعتراف دوله تركي خلافه اسلامي اعاد ذهن مافعله سلف جيش خرج شبر عربي استمع استمتع احتقر خليجي 72,monther72
صحافه اعلام مهنه عظيم ل اهل اختصاص فلايصح قال مغرد اعلامي راى ا سلطان قحطاني ا سلمان دوسري جميل جميل ذيابي ساعد ا محمد ساعد شعر اهميه مهنه دور مرجو هجمه شرس بلد استاذ سلطان قحطاني واحد رائع 72,monther72
صريح خارجيه اماني تقارب وقت غباء شيء كثير معلوم نظام عاش عزله محيط فلاعلاقات ل الامع اسرائيل و ايران توهم سعي اختراق منظومه عربي ممكن عبر دوله عربي مبادره شان لذا لاطريق 72,monther72
عب شرح افائد اسم عربي قديم احضار عربي ل تركي موجود معجم معنى كتاب احضار عباسي مغول عنى ثبات بقاء شيء ماهو 72,monther72
ساحه قليل خرج اسم سلط اتباع اخذ شتم تطاول تحقيق جرؤ افتخر خرج اسم صور عز قوه 72,monther72
اب ماجاء فضل تنكيد ابو نضال ابو جهاد ابو كفاح رويترز نشر تقرير تحدث حصه سوق نفط اعلى 4 ۰ سنه 72,monther72
جمال ريان صحافي محلل قدير استطاع شرح سبب رفع صوره تميم والد بايو يوم احداث و حديث صفه محلل وقت طبيعي صفه محلل مالرساله اراد ايصال نظام انقلاب 72,monther72
احدود فرحه سعودي قال مجد عوفي عوفي كرم عدو الم اخص برء تهنئه سلم ناس سلم 72,monther72
صيب مصيبه لايعرف انسان تاريخ حقيقي احضر احضر لماذا احضر ظهر صدق مسلسل قصه عثمان مشكله كبير لذا وجب عادى تثقيف بلغ حال قال عثماني عربي فخر عثماني ماحدث ذل انسى نفس 72,monther72
رتقي مرتقا صعب اهل ل ماعلاقه عجم و ظهر نس نفس بدا تحدث محتل اعلم ياهذا ارجع فقط خدم عندها ترك لبكيتم دم عرف حجم قدر ذكر خط احمر وضع ل ذكر دك ثني وجود الزم حد 72,monther72
قال مهم جد دكتور تركي دواد مستشار ماكن سعى تاكيد سنه افرق صفو عثماني مطايا ل 72,monther72
لت زمن بعيد هدف حقيقي معنوي مالي وجب حذر حذر تعاطف يوم سوق ان عقل عمل بدا محاسبه سوق شعب خليج 72,monther72
لى قال مقاطعه فكك سعوديه اماره بحرين مصر اجتماعي دوله مفكك داخل سبب مقاطعه نظام راى ناس تتقاتل شوراع راى حاله طلاق تناحر تعامل عقل شعب ذكرى مقاطعه مبارك ل 72,monther72
سلسله هام مدير مكتب ملك سلمان حفظ الله امير رياض وضع نقطه حرف تاكيد تحقيق كشف كثير استبعد رابط 72,monther72
قال زار شقيق نسبه ل افرق عماد مغني اجرم حق ذكر موقف غنوشي داعم فرح سفك دم شقيق يوم غزو عراقي 72,monther72
ؤال توقع تحدث فتح اغا بقيه ترك حكومه تركي رفع لغه عربي عاده ترك 72,monther72
ل اندفع دافع داعم روج ل كتيبه دعا اطلاع فديو ارفق قال ل لاشليله اغطي خمالي غطى خمالك اهم وطن اطلع جمعيه ابقى شكر ارخص وطن نظر باع وطن خاطر معرف وهمي 72,monther72
ماكن تواجد ذباب تعليق وجد رد فضيحه 72,monther72
عد رواق عثماني نخاصم ان حجر اسود سرقه ل ضوء موقف موضوع رواق عثماني مهاجمه فتح ل سيكتبونه توقع موضوع 72,monther72
ا راى و دعم موقف ابيض سلط قناه خبيث سخر اعلام رمز استضاف قناه تابع ل معارض ضد دوله زار بوليساريو دعم اشهر قال قبح الله اخر ماي وطن 72,monther72
علم صحيح اخذ ترك مجموعه كبير شبك سمع نهيق ليله 72,monther72
اشاء الله يوم متجمعين حساب وزن واحد ذباب نفس رد ظهر ضعط عصملي ضغط شديد سنه ماضي عموم لايزال 8 ۰ ٪ محرر خرج غازي انتظر خبر سار صوت مسماري 72,monther72
يب اخفي صوره اسفل تغريد عموم ارض سيف جرب دافع شبر رفع سيف كسر كسر 72,monther72
بع استفتاء ب مهم جد تاكيد عربي حر انسان قليل كرامه ايثق احتاج قلب نتيجه 72,monther72
عذر وشيحي موجود عجم راي معروف قديم مساحه اكبر سيطره عرب اربع سنه رجل ابطال ذنب فلاتسعجل طار ثبت ولاء فلازالت مساحه اكبر ابطال 72,monther72
شيخ خالد سبيعي 2 ۰ 14 فسر كلام عجيب جد 72,monther72
ذباب الكتروني عمل طريقه وقح تجاوز فكره اغلاق حساب وجود حساب احتياطي وجد حساب تاريخ قديم اتى حساب مجهول قال حساب استحق متابعه تغريد 2 ۰ 2 ۰ تبع باقي ذباب قروب حقيقه حساب بديل خبيث اوقف 72,monther72
ان فهم معنى مقوله تتطهر مقوله تدرج اسلام سمع محاضره لاتظلموا مثلي 72,monther72
دوله تحاكم خيانه و رجا لاتسعجل تحقيق سير قضيه تاكيد خرج ل قضيه جديد 72,monther72
فعل خيانه قياده يد يه احضر ال فتح ل مكتب وضع اساس اساسي سير منظومه اغلق مكتب اوكل امر اسرائيلي تولى اداره امر 72,monther72
ا ايقاف استيراد فتح مصراع سياحه تجاره سلاح ماينفق مكان خدم مقام عدو عربي مسلم ايقاف استيراد دوله 72,monther72
قال مختلف قال ملك سلمان ل مكانه خاص نفس انظر عاصفه تصفيق برلمان امن امن سعوديه 72,monther72
عذره رؤيه يوم احد يوم مناسب ارفع حظر 98 ٪ محظور حساب عام خير 72,monther72
شاهد قبه يوم احتضن صلاه سال الله سلامه دين صاحب جرؤ قال ل حكم اسلام يمن صلى مكان فرح ايد صلاه صور اعتبر مسلم اصل مايك ل 72,monther72
ي تدمير منظومه موجود وقت تواجد وزير دفاع تباهي ترك دخل غادر رساله واضح عصي عجم اضافه تدمير اثر رفع معنوي عرب كسر معنوي محتل ملشيات مرتزق 72,monther72
هنئ مناسبه عام خير اقبل الله صيام قيام صالح عمل عدو الله ايا عام عديد ازمن طويل سالم دين بدن مال ولد مبارك 72,monther72
عد تسرب خبر اتخاذ اتحاد اوربي اجراء مراقبه شاطئ طار هاكان فيدان اسرائيل مناقشه كيفيه تزويد ملشيات دواعش انتظر راى 72,monther72
اشرعيه ان شرعيه مجلس نائب تحرك ملشيات ارهاب دواعش عنى مواجهه عالم وضع خط احمر خط اصطف شعب كامل حفظ امن قومي ملشيات حرب وكاله 72,monther72
سنه تمنى سمع راي راى صوره سيئ اتهم دين خلق تربيه سبب تحذير نال كلام قبيح سبب موقف راى اخوان ثوره طابور فتره 2 ۰ 11 2 ۰ 12 و 2 ۰ 13 اصعب 72,monther72
ندم تعلم فرقه اعراب عربي هاذي شرح ل شرح ل عربي امن الله يوم اخر اتخذ ماينفق قرب عندالله صلاه رسول قربه ل ادخل الله رحمه ان فخلك عميل اسرائيل استعد موالد ودع اسلام مسلم شان 72,monther72
حان الله هزيمه تحول حديث يوم رفض حل سياسي مرتزق قال لاتراجع هزيمه يوم يد جيش تراجع اعاده تموضع مرتزق اتى قائل احلول عسكري قله اعاد احل سياسي حكومه دارى 72,monther72
ن استمع حديث تافه تحدث ب علم نظام ازال عاش حاله غريب انكار اغرب اتى تسريب جديد اكد ماسبق خيانه طال عقليه ادار ازمه خرج عزله ذكرى مقاطعه مبارك ل 72,monther72
اكد عدم خروج عبدالرحمن ال عبدالرحمن وعد صلاه مغرب تجاهل عبدالله ابن حمد اتصال مستمر الغى خالد ابن عبدالرحمن متابعه استطاع طمان اهل امر اخير حامي تركي صفيح ساخن 72,monther72
نت فك نفس و نشوف موضوع 72,monther72
عرف خطر قال تحالف مواجهه عرف خطر فرق عداء خامنئي عربي تامل خبر وجد فعل غالب هاجم حليف 72,monther72
امل موقف خائن ورد ذكر تعلم لايوجد شريف حر صاحب كرامه مروه مجدي تعاطف اهل عرف حقيقه ضيع تعاطف ايد ازمه الي ان حذر خبثاء شد رحل 72,monther72
ثوره ب خطر بال سوري انتهى حال ب مرتزق جيش خطر بال وعد ربيع انتهى حال ب ذليل امر نهى حذر اهل لاتوصلهم حال شبيه سوركيين حديث مسماري اثار شجن 72,monther72
الله يادار زايد محل 72,monther72
بر ساري مايفعله نظام عربده سفك دم و و مايقابله عزل تام 72,monther72
علام اقرب ارض تحدث ماجرى صفيح ساخن انقلاب 72,monther72
ارسل رساله حوثي اشاد دور حوثي نصره اراد رساله استفزاز مشعر مسلم تاكيد اصطفاف محور صفو علم هنيه كاذب علم صدق شفى صدر خبث عرف ان خسه قال 72,monther72
اجاء يوم محقق اممي تبني امه متحد تقرير شرح حاله ارهاب عاش شعب سلطه عاش اشبه سجن كبير اكد نفاق ذنب تلاعب سذج ان ل عقل عمل نفاق و 72,monther72
ن بلغ طرف نعل اجتهد ليل نهار ضار تطاول صغير عرف حضر افتقد غاب مس مكانه عالي قلب عربي نباح جبان اختبا شاشه صفق ل اراذل قوم 72,monther72
عول خبر ال 15 مليار اخذ انقذ يوم قله وقت طويل اصغر انقذ اقتصاد جدير ذكر ميزانيه 58 مليار دولار استلم 3 ۰ مليار سبب اعلان جهز ملعب اصل 8 ملعب كاس عالم 72,monther72
ميل كتب لبس عوام خصوص تعامل قوم اخلاق ل امتهن سرقه ماينقل نقل فعل قطع حجر اسود سرق بيت الله حرام تزيين ضريح عياذ الله فعل سرق حجره رسول الله 72,monther72
ابع اغضب اتفاق اقام برنامج تالم تعلم حرك 72,monther72
قبض زعيم قاتل مرتزق ملشيات مسمى بكر رويضاني وجب سلم محكمه دولي كشف خبيئه تنظيم وصل رويضاني ارهابي التقى ب تعامل حكومه فضيحه 72,monther72
بر يوم صاروخ حمى طائره ثبت اسرائيل حمايه ذهب انسان وثق ب تولى حمايه علاج صوره تحيه احمق تلاعب ب صدق مشروع اسرائيل اختلف مشروع 72,monther72
تغريد قديم ل تخيل حذر نظام و مقاطعه اتحمل اذى اقرب وطن خسر قطع لحم سبب موقف فلايزايد احد شعب قال ملك سلمان شعب اهل اعلم جد ولد ال بوشريده 72,monther72
معرف نهائي اقيم ل استفاد عمل صالح اسم مجهول ضر شيء حرج رحب حسني نيه داعي صف قاد حمله تسويقي ل فضيحه سقط اخلاقي اثبت اخوان جدد 72,monther72
ان تبي نفى خلاف احداث و فزع اخلاف تميم قصاص ذكرتني فعل قال وكاله فلاني علانيه مهم صوره رفع علم ماجرى سحور 72,monther72
عاده ابن جلد تالق ثريد رائع رجا استمتاع ب حرف كتب ل قيمه عالي 72,monther72
رد يوم مهاتير حزب سعى تشكيل جبهه شارك ذنب صغير الله اكرم روحاني عقد اجتماع طرد رئاسه وزير اذل الله متسول قناه ظن قريب راى معتوه وضع 72,monther72
شكر كتب حرف سال الله اجزى خير جزاء غفر مالايعلمون اعتذر وجه حرف انتبه ل هاشتاق سال تعالى شاهد خير اللهم 72,monther72
علج انتفض معاتبه ذكر مختار وقف وصف مختار قاطع طريق قله وقت طويل مايجري تصفيه اكد مايحدث ان متابع ملشي مايعرف عمليه ايجد عربي شريف ادعوكم قراءه بيان بركان 72,monther72
تاريخ اعاد نفس سبحان الله سحب سلاح ليبي وهب نصره ل يوم تاريخ اعاد نفس و شبر ارض خاب خاب عميل ارجو سماع حلقه تمعن مقبره عثماني 72,monther72
ن صدق علي عبدالله صالح اشرف حمد ابن خليف حمد ابن جاسم بقيه نظام وصول مستنقع وصل ل 72,monther72
استودعناك فلاتجعله اخر عهد ب اعد عام عديد ازمن طويل اللهم اقبل صيام قيام صالح اعمال 72,monther72
ل خزي خرج تسجيل مجلس قذافي ذكر فعل ايام مسيره كرامه لؤلؤ حركه حسم تخيل سرب تسجيل دار تامر خزى خليج مجلس حمد ابن خليفه وقت شيخ خرج شنط جميل 72,monther72
مقطع شاعر سلطان هاجري اوقف شعر جسم فاض دمعه عجز كلمه موقف عظيم 72,monther72
صلتني قصيده صغير اراد تقرب ذنب تركيا دوحه عنى فرح عيد مشبوك شفى غل قصيده قبيح تضمن اساءه وقح قال حمدلله رد مرد مخزي شهر اساءه تواصل ذنب تعرض مال عرض اقرب رحم جديد مستوا 72,monther72
اقلق اخباري وجه سهم جواب تقرير رائع دعوه استمتاع 72,monther72
ظهر نظام احتاج مرتزق مختلف انتماء قرر نظام ملالي جديد منطقه اعتمد حرب مقبل هجوم مركز هجوم مضاد انتظر راى 72,monther72
لحمدلله يوم ثاني توالي تجاوز عدد متعاف عدد مصاب عدد اجمالي 59854 الله بدا تستطيح منحنى 72,monther72
ع اجتماع وزير خارجيه وزير خارجيه تقاسم دور منطقه واسطه عميل شكل متوقع سعى ل تذكر كتب سنه دعم عربي ندم دعم امن عربي قومي ف و لايخفون تحالف ضد امه 72,monther72
برئ قضاء تركي قيادي حزب تهمه اغتصاب انهيار اسره باكي مسجد توصيل رساله امر افطر قلب انسان قال مسلم قال وقوف رئيس شان ديني خطيب ثكلى خارج حضور قمه وقاحه 72,monther72
د قوي د طلال طريفي اعاد برمجه مخ قورش كتب مقال رد سعوديينلدى عثماني عقده سعودي علم سلف سعودي بنون عباس احضروه مملوك سلف لاتاريخ امكان ل وجد حاول صياغه تاريخ تاريخ كذب عمل 72,monther72
يوم يوم صعب بدا اعلان فرض عقوبه جمعيه التزام نظام قرار مركز مكافحه ارهاب رياض اقال فخ كادر قضى يوم اتى خبر اعتبار جماعه منحل حكم 72,monther72
ن يوم قال سيسي خط احمر جرؤ عميل داخل اقتراب سيسي رد تفاه شخصيه طوال سنه ماضي تعلق امر امن وضع خط احمر خط احمر بشار قال ل تجاوز رجل درع عربي 72,monther72
قرير اشاد ب دفاع وطن قابل تقرير حذر حساب مجهول سعى تفرقه مجتمع عمل متكامل اخباري ذكر مندس سعى شر قال هضم حق لذا عمل عدو لايعرف دافع معرف محسن احسن مسيء اساء 72,monther72
باع باحه طال عمر تبدل احساء حق مسلم مسلم ان مايغشه عشان قال ل جار مزعج صيحه راعي شكوى محكمه عدل منظمه تجاره منظمه طيران عنى موذي مشبك شبك ماراح يجيكم وش قول 72,monther72
ندم كاتب صافي دين عقيده اتى مقال حمل روح اسلام حقيقي مدرك تبعه ضرر مافعله اسلام صوره مسلم غرب تعسير حصول دور عباده دعوه استمتاع 72,monther72
انحدار اخلاقي وصل ل وذين مقرب نظام حكم اكد حاله نفسي عاش تنظيم حمد اثر مقاطعه 72,monther72
ضيح جديد حكومه فضيحه استعانه دواعش و اتى تسريب خبر صادم ذنب دعم اسرائيل خون عبر تزويد طائره مسيره بيرقدار نظام عالي تكالب صهيوني فرس دواعش اهل 72,monther72
لف الف مبروك كتب تمنى وزاره زار خارجيه يتبنون نابغه بدايه ابن سعود ل دور كبير ازال مرحله ثانوي تم تبني امل وجد قال صدى اسر تبني وزاره خارجيه ل 72,monther72
صاح منظمه تجاره رفض ادعاء 72,monther72
شاهد مايفعله حزب الله تذكر عظمه خيانه سعى تمكين اعظم مافعلته دعم ل حساب شعب يوم حدث دم غط قال اخير رجا نظام ادمن خيانه تغريد اسبوع اطلاع 72,monther72
شكل صوره تتطهر تجاوز محنه بكى خبثاء قدم قربان مرفا دلاله متجر الم ادرك شعب الي عانى ابتعد عربي وقع فارسي ترك ذنب صغير 72,monther72
ان انتهى مسرحيه محاكمه هزلي تفرغ موضوع قاسم سليماني عامل مشترك صفو راى تصريح شان مقتل ان عقل عمل 72,monther72
م تمنى كتب تغريد افضل اعلن خبر سجن والد نور تغريد احرج نظام فيترجون ساد اطلاق سراح حفظ ماء وجه اهل وضع اقامه جبري انقلاب انقلاب 72,monther72
ستون الف استاذ تركي عامري جزى الله معلاه شيخ خير جزاء خطوه تسابق زمن 72,monther72
مد ابن جاسم اذكى حمد ابن خليفه قال سيطر حاول حمد ابن خليفه انكار اقناع قذافي قناه حر داخل حمد ابن جاسم قال اعترف ان سيطره احترم عقل يستثره حركه مفضوح استخدم خليج 72,monther72
