شكر حكومه سعوديه قرار طرد شركه تركي استبدل اخر عربي مشهد جمال رونق روعه نعلمك تاجر قضيه,NidalSabeh
خرج فرنسي خرج اسرائيلي تركي استطاع ان حمى عميل داخل سوري ان مصير سقوط كتب سوري تاريخ جديد,NidalSabeh
نتهى شهر تموز رئيس اسد راسي سلطه مصداقيه ام مطبلي معارضه سوري ذاب ثلج باني مرج,NidalSabeh
ان ادرك امر بالغ اهميه استطاع ان وضع راس راسي عربي قاتل صليب مدى 192 عام ننكسر تراجع اخير حرر بلد واعد رفع رايه حافظ لغه عربي مقدس وان مشروع اسلامي مشروع قياده,NidalSabeh
عقل ان تم افراج عميل مدان تعامل تعذيب اسير لبناني سجن استمر توقيف محاكمه قضيه امام رفقه ان هنيبعل عمر سنه غيب امام علاقه ل قضيه قريب بعيد,NidalSabeh
ا معنى لاي اجراء ب الي مكافحه اذ اتخذ دوله الي قرار واضح وقف مطار مرفا معبر بري وان طبق حظر تجول مده شهر مطلوب يوم غزل عالم فرز حاله مصاب نتجه كارثه,NidalSabeh
ان نصيحه اقدم عالم عربي تجنب سفر الى ورود معلومه تفشي فيروس علم ان سفاره سعوديه طلب مواطن سعودي عدم سفر الى سبب تفشي مرض,NidalSabeh
صول فيروس الى عنى وصول حتم الى نقطه تجسس تركي سوري انصح معارضه سوري الى تجنب احتكاك جندي ترك,NidalSabeh
راخ منع حصار نقطه تجسس تركي حق ل ان تحدث اراد فعل ارض اراد,NidalSabeh
شكل شعب فلسطيني عالم عربي دوله جامل عصابه وقع اتفاق اعتبر ان تنسيق امني مقدس كفى كذب شعب فلسطيني سبب نكبه شعب فلسطيني,NidalSabeh
خيار امام لحظه الا قطع انترنت ترك شاهد شعب تركي جثه جندي ترك تويتر واجب تذكير الان ان عشر نقطه تركي محاصره وان اي حماقه ارتكب دفع ثمن كبير,NidalSabeh
ان نظام ملك ذره انسانيه ضمير قدم اعتذار رسمي شعب ارمني مجزره وحشيه تعويض ضحيه لان اصرار نكران واقع امعان جريمه ب الان يخلتف شيئا مجزره ارمني بشع,NidalSabeh
شعب تركي تساءل لماذا انتشر فيروس استفحل ان انتشر رغم ان بلد حد لان دوله اخذ اجراء يوم وضع مصلحه شعب اعتبار خلاف اخفى انتشار مرض شعب فضل سياحه اقتصاد,NidalSabeh
يسال والد جندي لماذا قتل ابن يا جواب اكيد ان اهتم سؤال والد جندي لان موضوع عنى مطلق عقد صفقه ابن بلال وان بقي ام بلال ابن بطوط سافر بلد الى اخر حساب شعب تركي,NidalSabeh
حل ازمه سد فراغ منح ثقه برلمان لبناني ل مصراوى,NidalSabeh
استبعد ان وصل الى لقاح فيروس شهر كانون ثالث عام خاص اعطاء تعليم خبير ترك وصول الى لقاح لان صنع حلقوم بقلاو عجز انتاج لقاح انقذ بشريه,NidalSabeh
ناصر دويله احد مطبلي عالم عربي اخبر ان ارعى ارهاب داعش صدر مرتزق الى سرق معده طبي شعب عانى تفشي وصل عدد الى 4 ۰ الف مصاب بقل وجه تركيا مشرق,NidalSabeh
مصير عصابه معارضه سوري,NidalSabeh
معلومه فان 6 ۰ سنه مدينه سوري توفى يوم اصاب فيروس مستشفى عسكري مدينه شهر احذر خطوره انتقال فيروس سوري عبر,NidalSabeh
يا اهل اذ جاء غد قال مهاجر انصار طو صرامي تردد مطلق ان كذاب شر,NidalSabeh
خمس مليون دولار مثابه فك جيب نسبه لاردوغان ارعن تبرع خمس مليون دولار ركب طائره ثمن نصف مليار دولار حقيقه ان اراد مال مشبوه موقف سياسي داعم قضيه,NidalSabeh
مشهد هروب لاجئ الى مؤشر ان حياه سوري وضع كارثي اطاق وجد مواطن سوري ان امام فرصه عمر خرج جحيم قفص تركي حريه قيمه مساواه اقتصاد بعيد لغه عنصريه تركي داعش نصره,NidalSabeh
دعا حكومه الي الى تغيير اسم شارع سليم زيتون الى اسم شهيد صاحب جمجمه رقم 5942 وان اقام ل احتفال عظيم تكريم قائد عربي كبير فرق اجزم ان قيد حياه قاتل مستعمر تركي,NidalSabeh
ابواب مئه الف اصابه فيروس نظام تركي تاجر قضيه حاول ان يلهي راي عام تركي قضيه هامشي حظي اهتمام شعب تركي ترك ثني كمام رغيف خبز وقف انتشار وباء تحديد مسؤوليه انتشار,NidalSabeh
حد تلفون جماعه طيران مجهول ارسل ل خاص يا اخوان,NidalSabeh
روب قال ان دفع ل قارب 6 مليار دولار نهايه عام 2018 لاجئ سوري مؤشر ان قصه مهاجر انصار الا كذبه كبير تعامل لجوء سوري كبزنس قذر درى مال ام بلال بقيه عصابه حاكم,NidalSabeh
انطلاق اعمال مؤتمر وزاري عربي عقد سلطه عباس امني اجتماع سي اي اعاده تاكيد استمرار تنسيق امني,NidalSabeh
جريمه سقط مرور زمن اذ رتب عربي اوراق ذهب الى محكمه دولي فان امريكي اسرائيلي تمكن توفير حمايه ل حد ادنى نفضح دولي نعر عربي اسلامي نكشف ارتباط رعايه تنظيم ارهابي داعش الى نصره,NidalSabeh
تضامن رئيس بلديه شرعي منتخب تعرض تهديد قتل شبيحه عداله تنميه استوعب الان ان خسر انتخاب بلديه اراد ان تخلص معارض باي طريقه ادرك ايض ان اي حماقه فتح باب امام ربيع تركي,NidalSabeh
ادعو عنصر معارضه سوري متواجد غرر ب الى تسليم نفس سلاح فور الى جيش ليبي قياده مشير جاهز توسط اخو ليبي تام سلامه حال استجاب نداء حساب مفتوح رغب تواصل خاص,NidalSabeh
سفاره سعوديه اطلق تحذير فراغ لان معلومه عشر اصابه فيروس وجود وفاه جنسيه متعدد مصدر فندق وسط كتم حكومه تركي خبر حفاظ تدفق سائح الى,NidalSabeh
اسف شديد كلمه رئيس مستوى حدث اجراء متوقع اتوقع اغلاق مطار مرفا معبر حدودي مده شهر حد ادنى فرض غزل داخلي ساكن طريقه وحيد استطاع ان نحم شعب اوقف تفشي,NidalSabeh
اهل قال بقاء حزب شيطان سده حكم عنى ان سياحه عربي استثمار اي تعاون اقتصادي استمرار حرب ليبيا توتر سقوط عنى انتعاش اقتصاد حسن ليره سلام حد قرار ل صندوق اقتراع,NidalSabeh
استطلاع اجرى شركه اكد ان فرصه اعاده انتخاب رئيس معدوم هبط صوت حزب عداله تنميه 34 ٪ حصول 52 ٪ اخر انتخاب يونيو 2 ۰ 18 قال ل اكتفى اسقاط نحاكم,NidalSabeh
نسبه سعوديه دوله خليج استطاع تعايش ظاهره مده عشر سنه خاص ان امتلك استفاضه مالي اكبر عالم استطاع دوله ان صمد 6 اشهر فقط امام فيروس خاص ان اعتمد سياحه شيف,NidalSabeh
صلح استراتيجيه بقاء سلطه فلسطيني عدم انهيار لان سلطه عباس وفر امن ل تنسيق امني مقدس ثاني لان وجود سلطه اعطى انطباع ان عمليه سلمي صحيح ثالث جسر عبور تطبيع الي عالم عربي اسلامي,NidalSabeh
ابناء ارض محتل عرف ان رئيس حركه اسلامي داخل جاسوس مرتبط احتلال والد عمل شرطه اسرائيلي خدم 67 شقيق اكبر محمد عمل شرطه اسرائيلي سن تقاعد شقيق اخر عايد عمل محقق شاباك وقت قريب,NidalSabeh
حاول اعلام تركي ان شوه صوره عربي مسلم حقيقه ان تفهم اجراء يه سيادي واي مواطن سوري تعرض لاي مكروه رقبه طرد اخير صادق قل يوم سوري مهاجر انصار,NidalSabeh
اجتماع طرح رئيس لجنه بنايه مشكله مبنى خاص مصعد بئر ماء اتفق تاجيل بحث اجتماع قادم تصدى الان صفقه قرن وجه ساكن مبنى تحيه الى قرار جريء زياره لان زياره سجين عنى زياره سجان,NidalSabeh
يوم وزير خارجيه تركي بلغ نظير اسباني قصه صديق وقت ضيق يوم استولى شحن جهاز تنفس اشترى,NidalSabeh
قدير شخصي ان زياره لواء الى داره سفير سعودي تاتي سياق ترتيب ملف امني اهتمام مشترك خاص ان خاض حرب ضد ارهاب قاعدي داعشي تشارك سعوديه معركه,NidalSabeh
حجم دور نحجم وان هدا جبهه اشتعل ليبي لان امام معركه حضاري متكامل قاتل ب عربي ضد محتل تركي نلام لان دافع ارض حضاره مستقبل ولد ان معركه حريه وجه ثقافه تبعيه,NidalSabeh
ياسي لبناني كابتن هانيبال تعرض ظلم كبير قضاء ضغط حزب علاقه ل قضيه موسى صدر,NidalSabeh
قليل يستجدي وقف اطلاق نار سوري قال ل ربى علم لعب عربي دخل اراضي عربي نسبه ل اتمنى ان بقي ليبيا شارك انتخاب تركي طريقه نقطه تجسس تركي اهداف مشروع ل يا,NidalSabeh
روسي يشتث معارضه معارضه ناشد تدخل انقاذ و عقل الان اهم حدث مشكله اكبر ان معارضه تعلم شيئا درس,NidalSabeh
اردوغان تفاخر انتاج سياره تصنيع ايطالي اماره اطلق الى فضاء,NidalSabeh
سب معلوماتي متزوج مغني تركي حاول ان اخفى زواج اعلام تتقمص دور زوجه مكلوم حادث تدبير مخابره تركي,NidalSabeh
مسلسل كذب تركي مستمر,NidalSabeh
جب مجتمع دولي ان تحرك فرض حكومه تركي دفع تعويض سوريا لان حكومه تركي رئاسه تحمل مسؤوليه مباشر ماساه سوري الم دخل نصره ايغور شيشان قتل سوري ادى الى هجره ان قصف سوري دمر,NidalSabeh
جب عالم عربي اغلاق معبر بري مطار مرافئ مده شهر تقدير فرض عزل دوله عالم تنفيذ عزل داخلي فرد ان قرار تم تنفيذ يوم ظهور فيروس وصل الى,NidalSabeh
رغب اكون قناه حديث مبادره مصري حل ازمه ليبي تدخل تركي سافر تاسع توقيت,NidalSabeh
نت مطبلي نال شرف ولاده تربيه مدينه منور تكبر يوم لان اجدادك باع بريطاني سلم يهودي عاش مطبل بارع ل برر جريمه حق اسلام اعتبر علاقه اسرائيل خدمه فلسطين,NidalSabeh
زير دفاع تركي نفى مقتل جندي ضابط اتراك رغم ان امن تركي اعتقل فتره صحفي تحدث وصول جثامين اتراك وزير صحه تركي قلل انتشار رغم تحول الى بلد موبوء استحق اردوغان نظام جائزه نوبل كذب دجل,NidalSabeh
اسم,NidalSabeh
عالم عربي وجه تحيه ضابط عربي لواء منصور ابن اجرى مدير مبحث اداري سابق رياض و خليفه سيف دوله مؤسسه قانون يا مكان ظلم تركيب ملف سوري جنسيه ولس سعودي متهم تزوير جواز سفر سعودي امور اخرى,NidalSabeh
الت صديق تركي حزب عداله تنميه رد فعل استهداف عصابه قال شيء سكت سكت استهداف اهانه تلقى ابواب ان اعجز رد فقاعه صوتي,NidalSabeh
زير دفاع تركي قال ان محادثه وفد روسي وصل الى نقطه معين اتضح نتيجه غضن يوم حدد موقف اساس مشكله يا سيد اكار ان يوم انتهى شهر شباط و يا ابو زيد غزي,NidalSabeh
افضل فعل وقت سكوت صمت عدم كلام مطلق معنى لف اعمل نفس ميت تجاهل ان رئيس دعس شارب,NidalSabeh
يديو استقبال اسير بدا واضح اطلاق نار لباس عسكري ان قرار حشد اكبر قدر ممكن ناس اطلق سراح اسير كمين محكم ابو مازن اكمل مخطط تجمع ان اغتيال منظم شعب فلسطيني نشر,NidalSabeh
استغرب ان تدخل عسكري لحظه ادرك ان اسقاط نظام راسي اولويه اردوغان الا ادرك اهل ان محطه اولى عبور اسقاط نظام تدخل عسكري مصري ي ضروره ملح واجب عربي اسلامي,NidalSabeh
ان سلطان قيد حياه تردد لحظه واحد تعليق راسي ساحه محاكمه تهمه خيانه اعظم بيع غد خرج عبد حميد اخر اعاد تصحيح وصله اكرم شعب الي واثق,NidalSabeh
اخشى اخشاه ان حدد موعد اخر اقترح ان نهايه اذار لان عدم تحديد موعد اخر اصاب ضجر حقيقه ان شهر سلى كثير حدد موعد نهايه شباط الى مهزله امام ترك ان مهزله امام سوري,NidalSabeh
زياره الى ذكر عربي زياره الى احتلال 1982 حقيقه ان وجد فرق احتلال اسرائيلي تركي,NidalSabeh
سعوديه اعترف اسرائيل عام 1949 تركيا محمد ابن سلمان استقبل ابن غوريون عام 57 عدنان مندريس محمد ابن سلمان ذهب الى قدس عام 2 ۰ ۰ 5 اردوغان محمد ابن سلمان استقبل بيريز برلمان تركي اردوغان محمد ابن سلمان حصل وسام شجاعه يهودي اردوغان,NidalSabeh
حاول نظام ان اعطى هاله قدسي واقع حقيقه ان تمتع باي قدسي اهميه عالم اسلامي عنوان مسلم وصله يا مدينه قدس اراض عربي ترك,NidalSabeh
اقترح اعداد قائمه شبيح مطبلي وطن عربي واحد ذكر اسم مطبل بلد,NidalSabeh
بو مازن خبر ان فهلوي شاطر عرف فاوض اسرائيل باع بلد عابد حلو ان قال الان الف,NidalSabeh
احيى مر تركي نضال ضد استبداد عداله تنميه قال ل استعدي معركه حريه صندوق اقتراع,NidalSabeh
احظ تقدم جيش عربي سوري جبهه تدخل عبر غاره انقاذ عصابه ميدان يوم تعرض عدوان تركي ي شك ب 2 ۰ 11 حقيقه 2 ۰ 2 ۰,NidalSabeh
اردوغان اراد ان خفف اجراء,NidalSabeh
تطاول اسياد ان صفق ل لان الان بدايه مرحله سقوط,NidalSabeh
معارضه سوري مستترك تهلل جبهه نصره برر اعمال ارسل مرتزق قتال خدمه مشروع تركي منطقه تحشر انف خلاف خليجي تحول الى اداه قذر صغير تساءل وقاحه اسباب تقارب خليجي,NidalSabeh
موقف دار افتاء مصري رافض قرار تحويل الى مسجد انسجم موقف سيد رفض ان صلى كنيسه قيامه لان اسلام دين تسامح اقبل اخر ان نظام مارس بلطج عربده علاقه مسلم ب,NidalSabeh
دافع هاجم معارضه سعوديه لان حمل مشروع تطويري امه ان معارضه حمل مشروع تبعيه لاردوغان اغلب انتمى فكري تنظيم عالم عربي سئم قرف اداه نفذ اجند اخر,NidalSabeh
زير داخلي وصف ضحيه زلزله تركي شهيد فائده قتيل القاب تراب مواطن تركي قتل زلزله انتظر حكومه ترميم مبنى اهتمام حياه ناس حكومه دعم ارهاب زياده حساب بنك,NidalSabeh
ليل كلام كثير معنى,NidalSabeh
صدر فيروس الى دوله عالم بقل شيء دعا قلق,NidalSabeh
امار خير رحم الله شيخ زايد,NidalSabeh
فرقه و قتل شعب امم تاجر قضيه شعب ثاني انقذ امم عالج فقير اعطى بشريه درس خلق,NidalSabeh
اله انكار عاش نظام فرض مجتمع دولي ارسال بعثه تقصي حقيقه مدى تفشي فيروس اطلاع وضع شعب تركي نظام قدر مجتمع دولي تحرك سرعه ان وصل الى كارثه,NidalSabeh
ردوغان اعتدى كنيسه مقدس نحم فرقه عربي تركي نظام انقره ارعن حاجه الى الف سنه ضوئي وصل الى اخلاق عربي ثقافه,NidalSabeh
اذ اعلن حاله طارئه ولايه متحد امريكي مواجهه فيروس ان اتخذ قرار تجاوز حاله طارئه عزل عالم شكل كامل اغلاق مطار مرفا حد بري فرض حظر تجول مده 15 يوم حد ادنى ظهر مرض اعزل فور,NidalSabeh
سبع تركيا اعتقل تحدث اصابه فيروس كورونا,NidalSabeh
لماذا احب كره لان ابن سلمان اظهر وجه اسلام حضاري امام مجتمع دولي ان شوه اسلام دعم تنظيم عمل الان تاجيج حاله طائفي مسلم مسيح مسرحيه انتخابي,NidalSabeh
درك ان فعل ل شيئا معسول كلام ادرك ايض ان اقسى امكن قدم سلاح فعل امر بدايه حرب سوري تناسى ان جاء الى لحمابه اتفاق 17 ايار نتيجه سقط اتفاق 17 ايار خرج,NidalSabeh
موقف عربي اخلاقي,NidalSabeh
رد وحيد عمليه ارهابي استهداف قوه تركي,NidalSabeh
ان قادر حشد 35 ۰ الف لماذا حشد عدد يعتدى لان ادرك ان تضامن غضب سيد خوج ماضي عميل خجل امام عميل وقح,NidalSabeh
نامل حكومه سوداني ارسال سلاح جيش ليبي قياده مشير تسلم متهم ست امن مصري تعليق,NidalSabeh
اخشي اخشاه ان استغل انشغال عالم فيروس شن عمليه عسكري واسع نطاق استهدف حماه حلب حمص شهر كانون ثالث عام,NidalSabeh
باء اعتقد متو ان شارع لبناني تحرك خرج مظاهره عارم تنديد كلام اعلامي حقيقه ان عنى شيئا شعب لبناني عالم عربي دليل ان تحرك احد ان حاله عربي تعاطف قضيه ارمني كردي,NidalSabeh
ثقافه امن تركي تهديد قتل يطبل ل بقي نواجهكم واجه عميل منطقه ارتاح ل بال سقط اخواني,NidalSabeh
لحظه انتظر رد تركي مزلزل نهايه شباط لان بقي الا يوم اذ اخونجي اعتبر ان رد فتح معركه سراقب امر مثير سخريه تمخض جبل ولد فار اليس يا,NidalSabeh
اريخيا وقف تركي قضيه عربي ان فرنسي ضد ي اسرائيلي ضد فلسطيني ان يا سيد الى باع وهم دجل اسى ينتسى يا سيد تجربه تجربه مرير,NidalSabeh
جمال اخبر ان معجب تجربه رائد مجال حريه خاص ان اعتقل 227 الف تركى تهمه انقلاب مزعوم,NidalSabeh
ائح اتهام تركي اصدر قضاء خلفيه قضيه اشرب ميت سلم اي مواطن سعودي اذ اراد ان طبق عداله تسليم قاتل سفير روسي حكومه روسي ضابط ترك قتل قائمه طال,NidalSabeh
وافق ادخال فقير الى اتحاد ان رفض لان امكن ان اقبل وجود نظام صدر ارهاب الى عالم الى نظام اردوغان مرفوض منبوذ اوربي عربي مسلم,NidalSabeh
طو رمي اوراق مهمل اشبه حركه ارسل سفينه الى يا اراد رمي اوراق صفقه قران اراد ذهاب الى سبق الى نتيجه تطبيع,NidalSabeh
يوم عالمي دعا شعب تركي عظيم الى اسقاط نظام طاغي لان طريق مر انقره فعل نصفق ل كثير تردد اطلاق اسم شارع ساحه افعل يا كليجدار عالم عربي انتظر خطوه تاريخي,NidalSabeh
جب عربي تحرك الان فتح قناه تنسيق امني عسكري سياسي خاص ان موقف فرنسي جيد جهه رفض دخل اراد فرنسي مراجعه موقف ادانه تدخل تركي سافر سوري تصدير ارهاب داعشي,NidalSabeh
جيش عربي سوري لاحق ثني خليه نائم عصابه ان قضاء ظاهره تكفيري عنا بدايه انتهاء مشروع تركي عالم عربي لان بوابه عربي اذ سقط سقط اذ انتصر نهض جديد,NidalSabeh
اسرائيل ان اتخذ اي اجراء لان مهمه اكمل وجه كلف جهاز امن ضبط شارع تمرير اتفق اسرائيل,NidalSabeh
عوده حريه مسجد اقصى مبارك تم سقط نظام طاغي اردوغان,NidalSabeh
نظام تركي سخيف اعتبر ان عمل فولو مدير صحه عالمي امر استدعى نشر خبر احتفاء ب,NidalSabeh
حاضر محكمه اسطنبول اخبر قاضي ان قال ل جلسه خاص اردوغان اجير صغير تعاون امني صدر ارهاب داعشي الى اراد ان سرق نفط وان تحرر الا اسقاط نظام تركي,NidalSabeh
شعب تركي عانى 6 ۰ الف اصابه فيروس راقب ثني تجربه رائد استطاع ثنائي اداره شان دوله هدوء تام حاجه ناس غذاء دواء مواجهه ان ثرثار فشل تام ربطه خبز شعب جائع,NidalSabeh
احدى فيديو نشر رحمه الله,NidalSabeh
ن صلح حال امه اسلامي الا اسقاط رمز مشروع اسرائيلي لان طريق اسقاط يبدا اسقاط حزب سفال تبعيه قاد رهان الان شعب تركي عظيم,NidalSabeh
اعلم ان صوره تسبب ل جلطه يا اقطاي,NidalSabeh
ل ل سابق ان سرق مصنع تعاون سرقه نفط سوري يوم سرق صين معده طبي امام لص تربع كرسي رئاسه تركي,NidalSabeh
يب وين اردوغان يا تركي لماذا ارسل جيش مساعده مستضعف ايغور لماذا ارسل جيش مساعده مستضعف روهينغا لماذا ارسل جيش مساعده مستضعف هند لماذا ارسل جيش مساعده مستضعف كشمير لماذا ارسل جيش مساعده مستضعف فلسطين اخبر يا تركي,NidalSabeh
نت اتمنى ان وقف اطلاق نار وان استمر تحدي جيش سوري راى امكن ان فعل ان طبل اجوف هدد يثرثر كثير فعل شيئا نهايه مطاف عرف عرف اسياد عرف ادار سر لبيب اشاره فهم,NidalSabeh
افضل فيروس ان حرم ظاهره استعراض فيلم تذكر ذهب الى جسر انقاذ مواطن تركي ينوى انتحار افتتح اكبر مستشفى اطول نفق سياره تركي تبين ان صنع شك ان ل فائده نظر نصف ممتلئ كاس,NidalSabeh
حجم شبيحه اردوغان تركيا 7 ۰ ۰ الى الف شخص,NidalSabeh
تغنى ب ذباب اخواني احد مطبلي تنظيم اسامه ابن لادن افهم ان تحدث حريه ديموقراطيه تعبير راي نفس وقت دافع قوه ظلامي امن قيمه,NidalSabeh
قال ان اعاد هيبه عالم اسلامي يا سيد زليطان ان هيبه عالم اسلامي الا ان رجل رجي تعك ارسل جيش محمدي الى صدق ان زعيم اسلامي مؤمن قضيه امه ولس اجير صغير امريكي وصف رئيس,NidalSabeh
انتظر رد تركي صفعه باب اردوغان عامل نفس ميت بصق قال دنيا امطر,NidalSabeh
سبع ل اقطاي تاجر اردوغان قضيه لاجئ,NidalSabeh
شعب فلسطيني سعيد رفع علم الى جانب تركي لان شعب فلسطيني اخلاقي حضاري عانى احتلال سرقه اعتداء ممتلك,NidalSabeh
لماذا تتكتم حاله اصابه فيروس عيب معرض اصابه عيب عيب اخفى حجم تفشي شعب اعتقل ناشط صحفي تحدث انتشار فيروس ان اخذ اجراء سعوديه اماره باقي دوله وصل حال الى,NidalSabeh
