تمني شفاء عاجل صديق بوريس جونسون رئيس وزير بريطانيا امل ل شعب بريطاني صحه سلامه تحدي فيروس كورونا مستجد سنواجهه الله اراده عزيمه تضامن بشريه,MohamedBinZayed
عطاء مجتمعي محمد ابن راشد قيمه راسخ مبدا انساني نسج ملامح شخصيه قيادي فكري متمسك ميراث انساني كبير اباء مؤسس اتخاذ ايا نهج مسلك اصيل,MohamedBinZayed
سرني يوم رؤيه وجه شابه مشع امل طموح تحدي مجلس جيل مستقبل مجتمع ناجح كثر مبادر مبدع ملهم اماره فضل الله زاخر نموذج قاد مسيره خير تميز رياد مرحله قادم,MohamedBinZayed
الص تهنئه تمني توفيق فخامه فلاديمير بوتين مناسبه فوز فتره رئاسي جديد متطلع عمل سوي تعزيز علاقه تعاون بلد دعم اساس امن استقرار منطقه,MohamedBinZayed
خور رؤيه شاب وطن حامي حمل شرف جندي قيمه راسخ اهبه استعداد جاهزيه معتز هويه انتماء و متسلح معرفه عسكري قدره عملياتي عاليهثقتنا ب كبير تعزيز مكمن قوه تشييد حصن منع وطن غالي,MohamedBinZayed
ناك نموذج ملهم لامس عطاء انسانيه صميم حياه ناس ترك مبادره بصمه واضح صحه بشريه ابرز صديق بيل جيتس تقدير عرفان جهد خيري استحق اماره وسام اتحاد,MohamedBinZayed
انجاز فخر اماراتي مقيم ارض دوله نتاج جهد وطنيه واثق قدره صنع فارق نهنيء نفس اعتز عطاء ابن اماره,MohamedBinZayed
بحث رئيس صيني شي جين بينغ اتصال هاتفي علاقه بلد استراتيجيه اكد تضامن اماره صين مواجهه تداعي انتشار فيروس كورونا مستجد استمرار تقديم مختلف شكل دعم مكافحه فيروس,MohamedBinZayed
ررت يوم حضور ملتقى نظم صندوق وطن تكريم داعم صندوق فرد مؤسسه قيمه عطاء تكافل مترسخه اصيل ابناء اماره,MohamedBinZayed
رفقه رئيس مصري عبدالفتاح سيسي حضور افتتاح قاعده برنيس عسكري مطار مدني انجاز نوعيه عكس رؤيه مصر طموح افق تنموي شامل عزز دور محوري منظومه امن عربي استقرار اقليميتمنياتنا ل مزيد تقدم ازدهار,MohamedBinZayed
حث هاتفي رئيس سوري بشار اسد تداعي انتشار فيروس كورونا اكد ل دعم دوله اماره مساعده شعب سوري شقيق ظرف استثنائي تضامن انساني وقت محنه سما اعتبار سوريا عربي شقيق بقي وحد ظرف حرج,MohamedBinZayed
باراك قائد خليفه ابن اماره يوم وطني 47 تمنى مناسب خير ونماءتقودنا نجاح اخر اوطان تبنى حب وفاء عملوستبقى عطاء شعب رهان حقيقي مواصله مسيره تقدم ازدهار تحقيق طموح تطلع مستقبل,MohamedBinZayed
لقي اتصال هاتفي جلاله ملك عبدالله ثاني ملك اردن شقيقناقشنا سبيل تعزيز علاقه اخوي راسخ اهم قضيه تطور منطقه اهميه عمل مشترك مجتمع دولي تثبيت امن استقرار,MohamedBinZayed
رت متحف مستقبل ابتكار حكومه خلاق فعاليه قمه حكومه عالمي اعتز دور دبي استقطاب عقل و تمكين حكومه عالم استشراف افق مستقبل اطلاق مبادره خدمه مجتمع شعب عالم,MohamedBinZayed
هاني الي خادم حرم شريف ذكرى بيعه رابع شهد مملكه حكمه قياده تقدم ازدهار وثب عزم حزم تاريخي استقرار منطقه حافظ امن عبر عهد اعتزاز متانه علاقه اخوي راسخ سائل مولى ان ادام صحه عافي مواصله مسيره خير,MohamedBinZayed
ابار ل حل عام هجري جديد مستحضر قيمه ذكرى تسامح تضامن تعايش حب خير اخر,MohamedBinZayed
طلق يوم حزمه مشروع تنموي سياحي منطقه ميناء احد اهم واجهه بحري اماره ابوظبي عجله تاهيل تطوير منطقه حيويه نام متواصل اسعاد مجتمع رفاهي عاصمه وجهه جذب مقيم و زائر و مستثمر,MohamedBinZayed
ليله حزين شهد عالم احتراق كاتدرائيه نوتردام تاريخي باريس وقف متضامن متعاطف فرنسا قياده شعب خساره احد اعرق اشهر معلم تراث انساني عالمي منار توحد شعب جمع خير,MohamedBinZayed
شارك قمه مجموعه عشرون استثنائي 2 ۰ مواجهه فيروس كورونامواقف مقرر مهمه قمه جسد وعي ضروره بناء استجابه دولي متسق تحديالامارات دعم شارك تحرك دولي جماعي تصدي فيروس احتواء تداعي استطاع معاومعا فقط تغلب خطر كبح جماح,MohamedBinZayed
لقي اتصال هاتفي مستشار الماني بحث اوج تعاون وثيق بلد مجمل قضيه اقليمي دولي تطلع مستشار ميركل الى معالجه تطور حالي منطقه حكمه حوار حقق تطلع شعب استقرار سلام,MohamedBinZayed
حث رئيس كوستاريكا كارلوس فارادو اتصال هاتفي علاقه صداقه تعاون بلد جهد تصدي جائح كورونا احتواء اثر مختلف مستوى دوله اماره واصل اطار نهج انساني ثابت دعم شعب صديق مواجهه مختلف تحدي ظرف صعب,MohamedBinZayed
سلم نسخه موسوعه سلم جزء تسامح شيخ عبدالله ابن موسوعه ناقش قضيه سلم تسامح مشاركه 1 ۰ ۰ باحث باحث مختلف دين,MohamedBinZayed
سعد لقاء احد ابن اماره متفوق احمد حوسني حصل شهاده ابيتور الماني اعلى مرحله ثانوي مستوى عالم ثقه كبير قدره ابن تحقيق نتيجه مشرف نفع خدم وطن,MohamedBinZayed
حث رئيس روسي فلاديمير بوتين اتصال هاتفي تعزيز علاقه ثنائي مجمل قضيه اقليمي دولي شكل خاص تطور حدث اخير اهميه حفاظ امن منطقه استقرار معالجه قضيه حكمه حوار,MohamedBinZayed
اراد ابن بنت وطن كثف جهد اطلق عنان طاقه تحقيق رؤى قياده ترجمه الى منجز وطنيه تحقق ل تميز رياد,MohamedBinZayed
توحيد هويه مؤسسي شركه ادنوك خطوه مبارك تمكن اكبر شركه وطنيه تفعيل مكمن قوه دعم توجه رياد تنافسي,MohamedBinZayed
ع احتفاء عالم يوم مراه احيى اخت بنت نساء عالم مراه رمز محبه سعاده طاقه متجدد شارك مسيره بناء تنميه نبض حياه صانع رجل ملهم اجيال عام خير,MohamedBinZayed
ستدامه تعليم مخرج نوعيه ركيزه وطنيه هدف استراتيجي تضافر تعاون مختلف مؤسسه مكون مجتمع جهد متواصل تحقيق تعليم جوده عالي داعم مسيره تنميه نهضه شامل,MohamedBinZayed
لقي اتصال صديق سورونباي جينبيكوف رئيس قرغيزستان بحث تعزيز علاقه بلد سبيل تطوير اضافه الى مجال تعاون تنسيق مكافحه فيروس كورونا اهميه تكاتف جهد تنسيق تبادل معلومه خبره مواجهه وباء,MohamedBinZayed
لتزم تدعيم مسار تعاون بلد مواصله نهج بناء عطاء توحيد صف تحالف سعوديه خيار استراتيجي زاد قوه قوه اضاف بلد تنموي اقتصادي امني عسكري واعد حرص تشكيل نواه عزز تقارب توحد عربي قضيه مصيري,MohamedBinZayed
ررت يوم لقاء فريق عمل مبادره تعزيز قوه جواز سفر اماراتي بذل جهد لافته تصدر جواز اماراتي مركز عالمي كفاءه وطنيه عمل همه تفاني نفتخر ب انجاز مشرف مركز دولي متقدم ثقه مسؤوليه حمل استمر وطن موقع رياد,MohamedBinZayed
الله رئيس اسبق حسني مبارك قائد عربي عمل اخلاص وحده عربي استقرار وقف قوه ضد تطرف ارهابصاحب موقف تاريخي حرب تحرير كويتجمعته شيخ زايد رابطه كرس خصوصي علاقه بلد خالص تعزيه اسره كريم,MohamedBinZayed
محمد ابن راشد اطلاق شراكه استراتيجيه شركه دار اعمار توحيد جهد طاقه تعاون عمل سوي وفق خطه برنامج خلاق عزز رياده شركه تنافسي مؤسسه مستوى عالمي,MohamedBinZayed
ي ثاني ديسمبر تالف قلب توافق عقل صنع نقطه تحول جوهري تاريخ حديث تاسس تعزز مقوم بناء دوله سقف طموح يوم فضاء زايد وثق رؤيه سديد التفاف مؤسس تجربه وحدوي رائده قال نظير,MohamedBinZayed
هنئ كويت شقيق امير حكومه شعب عيد وطنيه شارك اهل كويت عز مجد فرح ادام الله امن استقرار ازدهار قياده امير حكمه سلامعلاقاتنا اخوي رابطه تاريخي راسخ ازداد قوه صلابه,MohamedBinZayed
بحث هاتفي رئيس تركمانستان قربان قول بردى محمدوف علاقه بلد صديق حرص مشترك ارتقاء ب افق رحب تعاون اضافه مستجد اقليمي عالمي تحدي انتشار فيروس كورونا,MohamedBinZayed
ابع اهتمام حلقه شبابي اماراتي صيني بادره عكس اهميه حوار شاب مختلف ثقافه ب اكتمل انجاز تعزز مسيره تنميه رهان مستقبل رائد لذا اماره استثمر شاب متعلم امن فكر دور مؤثر,MohamedBinZayed
ررت يوم حضور مرسم تنصيب صديق عزيز عبدالله رعايه دين مصطفى الله شاه ملك ماليزيا تمني ل توفيق نجاح خدمه بلد شعب,MohamedBinZayed
ل يوم مر يوم نحتفي ب رمز عطاء جزل نبع قيمه نضب فخر اعتزاز ادى اسره مجتمع وطن دعوه ل سعاده هناء مقرون محبه شكر تقدير عرفان,MohamedBinZayed
ابع اهتمام اجلاء عالق رعيه دوله شقيق صديق مقاطعه هوبي صيني اماره حظي رعايه صحي شامل تاكد سلامه عوده بلد شكر حكومه صيني تعاون نثمن جهد ابن متطوع مهمه ايمان راسخ وحده مصير انساني,MohamedBinZayed
يوم لقاء ابن طالب اوائل ثانوي معهد فني تطبيقي ابار ل اسره نجاح تفوق تمنى ل مواصله جهد حصد نتيجه مشرف,MohamedBinZayed
ا لمس وعي شركه مؤسسه مسؤوليه اجتماعي ظرف راهن بعث ارتياح عزز ثقه قدره اماره حكومه قطاع خاص مجتمع تجاوز ازمه مجتمع متعاون متكاتف وقف قوي وجه تحدي انتصر,MohamedBinZayed
حظ جميل قضيه معلم استاذ فاضل احمد مندي منزل استذكر عطاء اخلاص رائد تعليم دولهكانوا قدوه حسن علم خلق,MohamedBinZayed
لقاء عدد طالب دارس جامعه فرنسي كلمه ل تعليم رهان مستقبل واصل خطوه دافع اكبر تحقيق طموح وطن اماني مثابره تعلم مستمر حرص دائم توفير حاضن تعليمي مرموق تمكين طالب افضل علم معرفه,MohamedBinZayed
فاق عمل مؤسسي بلديه ابوظبي تطور جزء مهم رؤيه مستقبلي مدينه وظف امكان تحقيق خدمه مستدام ضمان نوعيه جوده لبى حاجه مجتمع رفاهي شكل مجمل رافد تعزيز مستقبل اماره اجتماعي اقتصادي تنموي سياحي,MohamedBinZayed
رؤيه محمد ابن راشد رياده خدمه حكومي اسعاد متعامل وضع دوله اماره قلب مشهد عالمي,MohamedBinZayed
اولمبياد خاص لعب عالمي ابوظبي 2 ۰ 19 مجرد جمع رياضي عالمي صحاب همه حدث سما قيمه رساله انسانيه قصه ملهم وراء نجاح سواعد انجز ابدع شكر لجنه منظمه اداء مشرف داعم راعي متطوع سهم ميز,MohamedBinZayed
لقي اتصال صديق عزيز امير تشارلز تحدث مستجد فيروس كورونا سبيل تعاون ثنائي سعد اطمئنان صحه تمنى شفاء عاجل مصاب بريطانيا صديق تجاوز ظرف اقرب وقت تضامن مواجهه ازمه عالمي,MohamedBinZayed
باراك فريق نجم ساحلي تونسي فوز كاس زايد نادي عربي بطل شكر فريق هلال سعودي اداء قوي نهائي متميز جمع قطب كره قدم حضر متعه ندي نجاح اخر تنظيم حضور تنافسي بطوله رياضي حمل اسم اغلى رجل تجمع اشقاء محبه,MohamedBinZayed
رت موقع اثري اقدم مسجد مكتشف دوله الى ان ارض طيب كشف ل كنز حضاري ثقافي انسانيه اكتشاف نزداد فخر هويه تاريخ اصيل ازداد قناعه مواصله عمل مضاعفه جهد مستقبل افضل وغد اجمل وطن خير,MohamedBinZayed
مرحله جديد حراك تنموي شهد مسيره نهضه اصدار رخصه تشغيل اولى محطه براك طاقه نووي سلمي زاد قوه متانه قوه اكبر كفاءه وطنيه فخر ب جهد متواصل استعداد خمسون سنه قادم خطه ماضي تامين احتياج دوله طاقه,MohamedBinZayed
ن عمق قلب شهيد تحيه اجلال فخر تقدير تحملينه قيمه مكانه كبير نفس ابن وطن ملهم قدوه اعلى,MohamedBinZayed
لقاء جلاله ملك محمد سادس لقاء تواصل عمل تنسيق تشاور صالح بلد اماره مغرب جمع علاقه تاريخي وطيد رابطه اخوي راسخ تطلع معا ارتقاء ب افق رحب اوسع مجال كافه,MohamedBinZayed
عا برهن عالم مستحيل ممكن تضحي رخص اماره صنع معا نموذج اشع تفاؤل وضع وطن اراد عون الله هنيء ل فخر شعب وطن ب,MohamedBinZayed
عمق مشعر تضامن مواساه صين صديق حكومه شعب حداد وطني يوم قضى فيروس كورونا مواطن كادر طبي شجاع عزاء ضحيه عالم متمني شفاء عاجل مصاب واجه تحدي عزيمه شعب اراده تكاتف,MohamedBinZayed
لى معلم معلم حمل امانه عظيم ادى رساله ساميه مهمه جليل قدوه مصدر الهام فخور ب وبعطائكم,MohamedBinZayed
بالغ سعاده اعتزاز و ترحيب افتتح لعب عالمي اولمبياد خاص ابوظبي 2 ۰ 19 حدث رياضي اضخم عالمي صاحب همه تنافس 7 ۰ ۰ ۰ بطل مختلف دوله عالم قهر صعب تحلى اراده وطن فخر,MohamedBinZayed
واصل هزاع منصوري سلطان نيادي استعد رحله فضاء فخور نموذج مضيء مسيره خير بناء رحله قادم صنع تاريخ جديد سماء وطن اكد دخول دوله اماره عالم اكتشاف فضاء سواعد ابنائهارحله الهم جيل مقبل تحقيق انجاز وطنيه جديد,MohamedBinZayed
تمنى امير تشارلز فيليب ولي عهد مملكه متحد صحه شفاء عاجل تطلع عوده ممارسه حياه طبيعيهقلوبنا مصاب مقاومه فيروس كورونا مستجد اماره وقف متضامن الى جانب مملكه متحد وقت صعب,MohamedBinZayed
هدائ باسل نجم اضاء سماء وطن عز بلد ب نفاخر نشيد صروح كرامه وببطولاتكم رايه وطن عالي خفاق,MohamedBinZayed
لقي مكالمه هاتفي جاستن ترودو رئيس وزير كندا تبادل وجهه نظر عدد قضيه تهمه بلد اهم تطور شهد منطقه,MohamedBinZayed
امر انشاء هيئه معا منصه شامل تفعيل منظومه مشاركه مساهمه اجتماعي اماره ابوظبي مختلف طيف مجتمع مواطن مقيم مؤسسه دعم جهد مؤسسه حكومي رامي تعزيز عمل تطوعي اجتماعي اماره,MohamedBinZayed
هد رئيس نان اكوفو ادو توقيع عدد اتفاقيه مذكره تفاهم دوله اماره جمهوريه غانه سعى الى تطوير الي عمل مشترك حقق هدف تطلع فتح افق اوسع تعاون,MohamedBinZayed
اقشت صديق بيل غيتس اتصال هاتفي تداعي فيروس كورونا عالم واجه تحدي كبير احتاج تعبئه تنسيق قدره حكومه مؤسسه خاص اطلاق مبادره فاعل تعزيز خطه مواجهه فيروس بيل غيتس رائد عمل انساني ظرف وقت,MohamedBinZayed
يوم لقاء قائد فرق تطوع مشارك اولمبياد خاص لعب عالمي ابوظبي 2 ۰ 19 محظوظ شاف نخبه عيال ابن مقيم بلد فخر ب تبنى وطن مشكور مجهود,MohamedBinZayed
روح عالي همه كبير قوه اراده ظهر ب هزاع منصوري سلطان نيادي مرحله رحلهاسهمت نقل صوره حضاري اماره شعب فخور ب شاب اماره طموح راهن منافسه مضمار تقدم عالمي,MohamedBinZayed
عمان شقيق امات عربي اسلامي قائد حكيم قامه تاريخي كبير رحم الله سلطان قابوس رحل عزيز رفيق درب شيخ زايد تقاسم حكمه اخلاص نهوض شعب خدمه وطني نعزي اسره كريم شعب سال الله ان تغمد واسع رحمه سكن فسيح جنه,MohamedBinZayed
مناسب عيد مبارك نعرب تهنئه ملك رئيس امير دوله عربي اسلامي متمني ل موفور صحه سعاده شعب مزيد تقدم رخاء ازدهار بلد امن سلام امه عربي اسلامي عزه رفعه,MohamedBinZayed
هنىء صديق رئيس شي جين بينغ شعب صديق ذكرى سبعون تاسيس جمهوريه صين شعبيه ربط علاقه صداقه تعاون وثيقه صين عزز تطلع رؤى مشترك مستقبل بلد تعاون تحقيق ازدهار استقرار تمني مزيد تقدم شعب صيني صديق,MohamedBinZayed
رئيس وزير جزر فيدجي خوسايا فوريك باينيماراما تبادل حديث تعزيز علاقه ثنائي فرصه تعاون اقتصادي تنموي مختلف مجال تهمه بلد صديق,MohamedBinZayed
ئوي زايد مناسب وطنيه تاريخي عظيم استذكر باني نهضه والد مؤسس زايد طيب الله ثرى تعلم زايد ارث عظيم زاد قوه اراده وثق مسيره انجاز قائد ملهم وفي نهج انساني مخلص,MohamedBinZayed
فيض مشعر فخر اعتزاز نحتفي يوم وطني ال 46 شكل بدايه مسيره حافله منجز حلم تحقق كبر تعالى اراده ابن وطن,MohamedBinZayed
لقي اتصال رئيس وزير هند ناريندرا موديناقشنا مسار علاقه ثنائي بلد سبيل تعزيز اهم تطور عالمي شكل خاص تداعي انتشار فيروس كورونا عالمي اهميه تنسيق جهد مكافحه معالجه اثر مختلف,MohamedBinZayed
ميع يوم امتداد اتساع وطن وقف وقفه عز شموخ احتفاء شهيد بار قلب نبض ب وببطولاتهم تضحي يغادرونا سكن ذاكره بيت بقعه ارض خيره,MohamedBinZayed
ول اماره قياده وشعباتعتز زياره تاريخي رمز رمز دين جسد ايمان مشترك قيمه محبه تسامح صفه طريق بشريه سلام امن استقرار تقارب ثقافه شعب,MohamedBinZayed
ل شكر تقدير مركز محمد ابن راشد فضاء عضو فريق اماراتي مهندس فني اسهم انجاح رحله استثنائي ملهم شاب عمل عطاء رفعه وطن,MohamedBinZayed
رحب رئيس وزير يابان ابوظبيعلاقات اماره يابان استند الى مسيره تاريخي ممتد ثقه تعاون احترام مصلحه متبادلهحرصنا مشترك تعزيز ارث خير شعبي صديق صالح,MohamedBinZayed
زيل شكر معلاه روضه عبد رحمن مبارك بذل عمل جهد كفاءه اداره شان ماليه اماره متمني ل توفيق مهمه و مسؤوليه قادم,MohamedBinZayed
امار نسج نهج خير ارسى زايد نموذج عالمي تسامح تعايش كسب ب قلب مليون عالم كثير امتداد وطن اكن محبه ل قلب تعايش ويشاطروننا حلم تطلع قال اماره بلد ثاني,MohamedBinZayed
الص شكر تقدير كادر طبي اصغر موظف الى اكبر وقف خط دفاع صف امامي مدين لهموعملهم امكن نسي,MohamedBinZayed
يس شعور اجمل راى سعاده بهجه وجه صاحب همه تحيه شكر سهم تمكين ابراز قدره حدث عالمي مقدمه عائله كينيدي شرايفر مؤسسه المبياد خاص لجنه منظمه متطوع جهه داعم راعي جمهور مؤازره,MohamedBinZayed
هنىء رئيس دوله نائب حاكم شعب اماره بعيد ضحى مبارك سائل الله تعالى اعاد وطن سعاده خير بركه مزيد ازدهار,MohamedBinZayed
هد رئيس برازيلي تبادل اتفاقيه مذكره تفاهم بلد سعى اقامه مشروع مشترك خدم تطلع تنويع تعاون تعزيز علاقه صداقه شعبي,MohamedBinZayed
سعد مشاركه محمد ابن سلمان حضور حفل ختامي ل مهرجان ولي عهد هجن محافظه طائف هنا نجاح متميز ابار فائز اشواط رئيسي نجاح حضور لافت جسد وفاء ابن منطقه تراث اباء اجداد اصيلوحرصهم تجذر غرس جيل قادم,MohamedBinZayed
هد رئيس اندونيسيا تبادل اتفاقيه مذكره تفاهم بلد اندونيسيا شريك مهم ل ثقل اقليمي دولي فاعل حرص مشترك تدعيم افق تعاون تطوير خير شعب صديق تقدم,MohamedBinZayed
عبر فرحه ابتهاج ابناء شعب ذكرى مجيد متوحد مزيد اعتزاز فخر رايه قياده,MohamedBinZayed
امه فخر تاريخ قيمه رمز وطنيه منجز حضاري انساني كتاب امار تاريخ وثق ابن طالب مرحله ماضي متجذر ارث زاخر حاضر رؤيه مستقبل استلهم جيل تاريخ عزم اصرار تحدي عبور وطن مستقبل منشود,MohamedBinZayed
هاني شقيق مملكه اردني هاشمي بعيد استقلال مناسب مجيد خلد ذكرى انطلاق اردن افق بناء تنميه شامل يوم قياده ملك عبدالله ابن حسين حث خطوه تطوير نهضه حضاري امار اردن نموذج وحده اخو متجذر,MohamedBinZayed
ضع سعاده انسان اماراتي اهم اعتبار نهضه تنموي شهد بلد اساس انسان رؤيه مستقبلي تحقيق افضل نظم اسكاني عمراني رقي وطن مواطن,MohamedBinZayed
نحتفي يوم عالمي تمريض عام وقف ممرض ممرض شجاعه خط امامي مواجهه جائح كورونا تحيه تقدير عرفان ل اماره عالم دور اساسي تضحي كبير ومقدرهمهنتهم جسد معنى رحمه رفق انسانيه,MohamedBinZayed
رحب فخامه رئيس فلاديمير بوتين ضيف عزيز اماره شعب زياره تاريخي جسد قوه علاقه اماراتي روسي ماضي معا تعزيز مستوى كافه مصلحه بلد صديق,MohamedBinZayed
سرر لقاء ابن طالب مشارك مبادره رحله اتحاد 2 ۰ 19 نظم جمعيه بيت متوحد رحله اتحاد متنوع غني تاريخ مكتسب وطنيه,MohamedBinZayed
ل تقدير توفيق محمد ابن راشد قياده حكومه مستقبل متطلع الى تحقيق هدف استراتيجيه مئوي اماره,MohamedBinZayed
